Headlines,Links,ArticleBodyText
Perseid meteor shower 2024 peaks this weekend.,https://www.independent.co.uk/space/meteor-shower-uk-2024-perseid-full-moon-b2591147.html,"Support truly

independent journalism Support Now Find out more Close Our mission is to deliver unbiased, fact-based reporting that holds power to account and exposes the truth.



Whether $5 or $50, every contribution counts.



Support us to deliver journalism without an agenda. Louise Thomas Editor

The biggest meteor shower of the year is set to peak this month, just days before the first supermoon of 2024.

The Perseid meteor shower has been visible since mid-July but is expected to peak on the night of 11 August, with up to 100 ‘shooting stars’ appearing each hour until dawn.

Before the meteors disappear for another year at the end of the month, a full moon on 19 August will appear bigger and brighter in the sky alongside them as the Earth’s natural satellite approaches the closest point of its orbit.

The occurrence of a bright supermoon is typically not good for stargazing or meteor watching, however on the night of the Perseids peak the Moon will set at midnight.

The Moon setting combined with warm conditions make it an ideal opportunity to witness the celestial spectacle, with scientists from Nasa and the European Space Agency (ESA) saying the best time to see them will be the pre-dawn hours before sunrise..

“The Perseid meteor shower, which peaks in mid-August, is considered the best meteor shower of the year,” Nasa notes on its website.

“With swift and bright meteors, Perseids frequently leave long ‘wakes’ of light and colour behind them as they streak through Earth’s atmosphere.”

The US space agency said skygazers can expect between 50 to 100 meteors per hour during its peak, with no need for specialist viewing equipment like telescopes or binoculars to view them.

The ESA advises people to head to an area with minimal light pollution and to avoid looking at screens or other bright objects for half an hour to allow your eyes to adjust to the darkness.

Several observatories are expected to live stream the night sky on the night that the Perseids peak, with telescopes pointed to the section of sky from which they emerge.

Radiating from the Perseus constellation in the northeastern sky of the Northern Hemisphere, which follows the more distinctive Cassiopeia constellation across the sky.

The bright meteor streaks occur as the Earth passes through the tail of the Comet Swift-Tuttle, causing debris to burn up in the Earth’s atmosphere at temperatures of up to 1,650 degrees Celsius - meaning the space rocks are unlikely to reach the ground intact."
Perseid meteor shower 2024 peaks this weekend.,https://1440wrok.com/illinois-sees-the-perseid-meteor-showers-this-weekend/,"If you're interested in catching what might be 2024's best meteor shower, this weekend's peak of the Perseid meteor shower should be the one that you're looking for.

The Perseids seem to realize that there's a fan base here on Earth, so they hang around the early morning skies for pretty decent amount of time, starting in mid-July and wrapping up in early September. Shooting stars from the Perseid meteor shower can be seen the entire time, but the peak, or best viewing times, are coming up this weekend.

They just got started on July 14th (people have already been reporting on their activities), and they'll do their thing in the heavens until around the first week of September, with the absolute best viewing being on Sunday, August 11th and Monday, August 12th.

Hope you don't mind getting up a bit early for the best show.

Getty Images Getty Images loading...

Getty Images Getty Images loading...

The People Who Know About These Things Are Really, Really Into The Perseid Meteor Shower, Calling It The ""Gold Standard"" Of Meteor Showers

Many experts are saying that more than 70 shooting stars is a genuine possibility, but Space.com is of the opinion that the show could be even better than that:

The shower peaks around August 11th and 12th, when Earth travels through the densest and dustiest part of this debris. In years without moonlight, the meteor rate appears higher, and during outburst years (such as 2016), the rate can reach 150-200 meteors per hour.

Obviously, having a clear, dark, moonlight-free atmosphere makes for the best viewing, and it looks like Illinois' skies are planning on being somewhat cooperative during this year's peak of the Perseids.

Full frame shot of star trail abstract futuristic background in blue tones Getty Images loading...

Getty Images Getty Images loading...

Let's Get To What You Need To Know If Catching The Perseid Meteor Shower Is Something You'd Be Interested In Doing This Coming Weekend

Unless you're someone with lots of stargazing equipment at your fingertips, you should be happy to know that catching the Perseid meteor shower does not require a telescope or binoculars at all. And, because the half-lit moon will set around midnight, you won't get lunar interference with your viewing, either.

Read More: Check Out Illinois' Dark-Sky Park For Stargazing

The best time to head out for a look is anytime after 1am on Sunday and/or Monday, all the way up to around 5am, or just before dawn both days.

Find the darkest spot (away from lights) that you can find and let your eyes adjust to the darkness for about 30 minutes. Then, scan the sky and wait for the magic to begin."
Perseid meteor shower 2024 peaks this weekend.,https://kawarthanow.com/2024/08/05/this-years-perseid-meteor-shower-peaks-on-august-11-and-12/,"Every August, stargazers look forward with excitement to the annual Perseid meteor shower. This year’s meteor shower will peak on Sunday and Monday (August 11 and 12), with 50 to 75 meteors visible per hour if you are in a dark location.

Every year from late July to early August, Earth plows through the interplanetary debris left behind by comet Swift-Tuttle when it passed close to Earth (the last time was in 1992). When the particles of debris — which can be as small as a grain of sand or as big as a pea — slam into the Earth’s atmosphere at around 210,000 kilometres per hour, they heat up to 1,650 degrees Celsius and are vaporized in a burst of heat and light, resulting in a “shooting star.”

The meteors are called the Perseids because they appear to originate from the northeast sky in the direction of the constellation of Perseus.

Advertisement - content continues below

While the Perseid meteor shower has been active since mid-July, the Earth goes through the densest area of the comet’s debris field between 9 a.m. and noon on Monday (August 12). Because meteors aren’t visible during the daylight hours, you’ll need to watch for them instead on Sunday night or Monday night, with the best times after midnight (when the first-quarter moon has set) until before dawn.

The Peterborough Astronomical Association will be hosting a Perseid meteor shower event from 9 to 11 p.m. on Monday (August 12) at Harold Town Conservation Area (2611 Old Norwood Road, Peterborough).

The family-friendly event is free and open to the public. Although optical aids are not needed to see meteors, association members will have telescopes and binoculars set up to view other wonders of the night sky. As with being able to see the meteor shower on your own, the event is weather dependent and will be cancelled if skies are cloudy.

Advertisement - content continues below

Tips for viewing the Perseid meteor shower

Find the darkest place you can, away from any light pollution, with as much open sky as possible. Rural areas away from city lights with few buildings or trees are the best. If you can’t get away from your city, find a park or golf course.

Lie on your back and take in as much of the night sky as possible. You don’t have to face Perseus (to the northeast) to see the meteor shower, but the more sky you can see, the better your chances.

Be prepared to stay outside for at least an hour. It takes 20 to 30 minutes for your eyes to fully adjust to the darkness, and the meteors come in spurts and lulls — so the longer you wait, the more you’ll see.

Stay awake. The Perseids are typically best between midnight and dawn, with the hours before dawn being the best time. During the peak night, the early morning of August 12th, wait until the moon sets at midnight."
Perseid meteor shower 2024 peaks this weekend.,https://avltoday.6amcity.com/culture/perseid-meteor-shower-peak-2024,"In the wee hours of the morning, our sky will light up with a celestial show. The Perseid meteor shower, widely considered the best meteor shower of the year, is predicted to reach its peak on Monday, Aug. 12 or Tuesday, Aug. 13.

Christened in honor of the meteors’ radiant constellation Perseus the Hero, the Perseid shower will produce as many as 100 meteors per hour at its peak. (It’s worth noting that they actually come from a comet called 109P/Swift-Tuttle, not the constellation.)

The pre-dawn hours of Monday and Tuesday are the best time to see the Perseids around here, but if getting up early isn’t your thing, some meteors will be visible as early as 10 p.m. And if you want to get an advanced viewing, PARI — one of only two Dark Sky Parks in NC — is hosting a guided experience on Friday, Aug. 9."
Perseid meteor shower 2024 peaks this weekend.,https://www.mlive.com/life/2024/08/join-fellow-stargazers-for-meteors-and-smores-at-free-beachside-astronomy-event.html,"HOLLAND, MI -- This week the Northern Hemisphere is expected to see an epic light show as the Perseid meteor shower reaches its peak.

Nothing says free entertainment like simply staring up at the sky. Why not make it a date and join fellow stargazers at the beach for a fireside experience."
Perseid meteor shower 2024 peaks this weekend.,https://www.theguardian.com/science/article/2024/aug/05/starwatch-perseids-to-peak-in-dazzling-shower-mid-month,"It is the big one for meteor watchers. The annual Perseid meteor shower will reach its peak of activity on the night of 12 August going into the early hours of 13 August. The chart shows the view looking north-east from London at midnight.

The moon will have 50% of its visible surface illuminated, and will be setting near midnight, leaving the sky as dark as possible for seeing the fainter of the meteors.

The Perseids will appear to emanate in all directions from their radiant point, located in the constellation of Perseus, the hero. They have been active since 17 July, and will persist past the peak until around 24 August.

On the night of 12 August, they will reach the climax of their activity, presenting star watchers with between 60 and 100 meteors an hour. Even though it is August, and summer in the northern hemisphere, dress for warmth.

Meteor watching requires patience. Experienced watchers often come equipped with blankets and deckchairs to be truly comfortable as the vigil extends into the early hours.

Although best-placed for observers in the northern hemisphere, the Perseids can also be seen down to the mid-southern latitudes."
Perseid meteor shower 2024 peaks this weekend.,https://m.economictimes.com/news/international/us/meteor-shower-know-when-and-how-to-see-the-perseids-at-their-best/articleshow/112296598.cms,"Best viewing time and conditions



Viewing tips and additional celestial events



FAQs





(You can now subscribe to our

(You can now subscribe to our Economic Times WhatsApp channel

The Perseid meteor shower , which is well-known for its high meteor frequency , is about to peak. Next weekend, specifically from Sunday night to early Monday morning, August 11 to 12, will be its busiest. Up to 75 meteors per hour were visible to observers during this peak period of time, as per the reports of MSN.Moonlight can affect Perseid meteor visibility even though they are usually brilliant. The moon will set this year, though, right before the Perseids are predicted to be at their most active. The American Meteor Society reports that on Monday, August 12, after one in the morning local time will be the best time to see. An hour after midnight, the half-lit moon will set, providing pristine, black skies for stargazers to enjoy.Meteoroids that penetrate Earth's atmosphere are what generate the dazzling streaks referred to as shooting stars . These tiny particles evaporate and heat up, leaving behind visible light trails. The Perseids move at a velocity of sixty kilometers per second, or 37 miles per second. During the peak, observers can typically see 50 to 75 meteors every hour, or roughly one meteor per minute. You should be in an area with little light pollution if you want to view the most shooting stars.Even though the Perseid meteor shower is renowned for its quick and brilliant meteors, it's important to understand that binoculars and telescopes used for stargazing are not the best tools for viewing meteor showers. It's important to let the eyes acclimate to the darkness and scan the whole sky in order to see meteors clearly. This year, there will be other celestial occurrences to be aware of for stargazers, such as planetary conjunctions, supermoons, and a rare comet flyby.The Perseid meteor shower peaks next weekend, from Sunday night to early Monday morning. During this time, you can see up to 75 meteors per hour.For the best viewing experience, look after 1 a.m. when the moon will have set. This ensures the skies are dark and clear, enhancing meteor visibility."
Perseid meteor shower 2024 peaks this weekend.,https://www.lehighvalleylive.com/outdoors/2024/08/perseid-meteor-shower-of-2024-to-light-up-the-night-sky-when-to-see-it.html?outputType,"Keep your eye on the sky. The annual Perseid meteor shower, considered to be one of the best meteor showers of the year because of its many bright shooting stars, has started to put on its annual show and will soon be peaking.

The 2024 Perseid shower is expected to be a very good one for people willing to stay awake and do some stargazing after midnight, according to astronomy experts at EarthSky.org and Sky & Telescope. They say the moon will be in its first-quarter phase, with about 50% illumination, when the Perseid meteor shower reaches its peak activity on Aug. 12.

“The best time to watch for Perseids will be starting around midnight (when the moon will be setting) until dawn,” EarthSky says. “This shower rises to a peak gradually, then falls off rapidly. And Perseid meteors tend to strengthen in number as late night deepens into the wee hours before dawn. The shower is often best just before dawn.”

To boost your chances of seeing some shooting stars this month, the EarthSky website says skywatchers should find a dark location — as far away as possible from bright city lights and street lights — and look up after midnight on Aug. 11, Aug. 12 and Aug. 13.

The Perseid meteor shower is most active in August, generating as many as 50 to 100 meteors per hour on its peak nights in dark locations.NJ Advance Media | Canva

Plenty of shooting stars

The Perseid meteor shower can generate as many as 50 to 100 meteors per hour in dark locations, assuming skies in your viewing area are clear.

If you don’t have an opportunity to scan the sky between Aug. 11 and Aug. 13, you still have a shot at seeing some Perseid meteors on other nights or in the pre-dawn hours. This popular meteor shower started producing small numbers of shooting stars in mid-July and will continue to do so through Sept. 1.

The biggest number of meteors, however, are expected around Aug. 12 because that’s when the Earth will be moving through the largest field of debris from the tail of a comet known as Comet Swift-Tuttle. The comet zips around the sun and leaves a trail of tiny ice and rock particles, and every August our planet passes through the debris.

Even though the particles are very small, when skywatchers on Earth see some of the fragments, they look like shooting stars streaking across the sky. And some look like big, bright fireballs.

“The meteors are colorful. And they frequently leave persistent trains,” EarthSky.org says. “All of these factors make the Perseid shower perhaps the most beloved meteor shower for the Northern Hemisphere.”

This meteor shower is known as the Perseids because “the radiant — the area of the sky where the meteors seem to originate — is located near the prominent constellation of Perseus the hero when at maximum activity,” the American Meteor Society notes.

The Perseid meteor shower is most active in August, generating as many as 50 to 100 meteors per hour on its peak nights in dark locations.Canva.com

Viewing tips for Perseid meteor shower

You can see the Perseid meteors from almost anywhere, but experts say you increase your chances of getting a good view if you go to a park or open area in a rural place, away from bright lights.

You don’t need a telescope or binoculars — just your eyes. But you should give your eyes about 20 minutes to adjust to the dark when you’re looking up into the night or early morning sky.

And EarthSky’s astronomy experts say if you’re looking for the Perseids, don’t be in a rush. “Give yourself at least an hour of observing time,” they say, “because the meteors in meteor showers come in spurts and are interspersed with lulls.”

Thank you for relying on us to provide the local news you can trust. Please consider supporting NJ.com with a voluntary subscription.

Len Melisurgo may be reached at LMelisurgo@njadvancemedia.com or on X at @LensReality."
Perseid meteor shower 2024 peaks this weekend.,https://denvergazette.com/outtherecolorado/news/up-to-100-meteors-an-hour-to-fly-above-colorado-as-best-show-of-year/article_7d949dac-5346-11ef-bcab-6b84b9ddb98f.html,Up to 100 meteors an hour to fly above Colorado as 'best show of year' peaks within days
Perseid meteor shower 2024 peaks this weekend.,https://www.inkl.com/news/want-to-watch-the-perseids-meteor-shower-this-week-these-are-the-most-spectacular-dark-sky-places-to-view-it-from,"Perseid Meteor Fireball Streaks Above Pine Trees.

The spectacular Perseids meteor shower peaks every August, and this year the 'shooting star' display will be most obvious overnight on Sunday 11 to Monday 12 August.

Expect a dramatic display of light trails as the Earth travels through rocks and dust left by comet 109P/Swift-Tuttle. They burn up in our atmosphere leaving bright streaks in the night sky."
Perseid meteor shower 2024 peaks this weekend.,https://www.sanmarcosrecord.com/features/annual-perseid-meteor-shower-takes-skies-august-10-12,"Thanks to the efforts of Dark Skies programs sprinkled throughout the Hill Country, Central Texas has a number of prime locations for stargazing. This is good news for people hoping to make wishes on some falling stars this August during the Perseid Meteor Shower.

Regarded as one of the most reliable meteor showers in the celestial calendar, the Perseids run from July 14 to Sept. 1, with its peak hitting on the weekend of Aug. 11-12.

“The Perseids meteor shower comes from the comet 109P/Swift-Tuttle,” Alan Martinez, Texas State Astronomy student and webmaster for the University’s Astronomy Club, said. “It’s a comet in Jupiter's orbit, and every year as the comet gets closer to the sun in its orbit, it begins sublimating material off its surface.”

This summer, Martinez is studying Swift-Tuttle and was excited to share information about the comet as it traverses through the solar system, causing the annual light shower we know as the Perseids.

“Think throwing a piece of really dirty dry ice and seeing the vapor path as it's in the air,” Martinez said. “Ultimately, that material is carried toward Earth where it enters our atmosphere and results in those really cool meteors that we see.”

For the best meteor-shower viewing (and optimal wish-making), stargazers are encouraged to find a destination where the stars will be unobstructed by light pollution. This is where all of us in the Hill Country are in luck, because Central Texas is home to six of the state’s seven certified Dark Skies communities, including Bee Cave, Blanco, Dripping Springs, Fredericksburg, Horseshoe Bay and Wimberley Valley. These Dark Skies locations have passed smart-lighting ordinances in order to shield the area from encroaching light pollution. Dripping Springs was the first community in Texas — and only the sixth in the world — to become a certified Dark Sky Community. With Blanco and Wimberley joining the initiative, these towns have broadened the commitment and scope of protecting the night sky within the Hill Country.

Though Martinez will be completing his internship program in Houston at the time of the Perseids, he recommends driving out to Wimberley to view the meteor shower. “It’s an official Dark Sky community away from some of the light pollution of I-35,” Martinez said. “The absolute best times to see meteors would be between midnight and sunrise, but some should still be visible earlier in the night if you're lucky. There should be around 90 meteors per hour, which is pretty awesome.”

Additionally, with the moon phase a waxing crescent at only 41% full, that natural light will have little impact on viewing the meteors as they streak across the sky.

Other nearby meteor shower locations include Enchanted Rock State Natural Area, which is designated an International Dark Sky Park. Campers in the park can enjoy an unobstructed view of Big Sky Country. Sunday to Monday night reservations are available, and due to the date being at the start of the week, the park probably won’t be crowded. Reservations can be made online at tpwd.texas.gov/stateparks/ reservations or by calling 512-389-8900.

According to the American Meteor Society, viewers will have best results around 2 a.m., when the constellation of Perseus will be highest in the night sky. Stargazers don’t need to look directly at Perseus — or even know the constellation’s exact location in the night sky — to see the meteors.

However, for San Marcans curious to learn more about the night sky, the constellations and other exciting celestial phenomena, the Texas State Astronomy Club hosts public observatory nights every Wednesday from 7:30 - 9 p.m. during the Fall semester (if the skies are clear).

“We also got funded a brand-new telescope for our observatory dome, so hopefully it will be up and running this Fall for everyone to check out,” Martinez said. “The home telescope had been broken for the past couple years, so we had been getting by with our other — equally cook in my opinion — scopes, which we typically pull out.”

Pending clear skies, the next public observatory night will be Wednesday, Sept. 11 at 7:30 p.m. Check the organization’s website at astrotxst.org or visit its Instagram and Facebook at @astrotxst for updates. The Texas State Observatory is located on the roof of the Supple Science Building on Vista St. It is a nonprofit organization run solely by Texas State students.

The next meteor shower will be the Orionids, which are a medium- strength shower set to peak Oct. 20. In a normal year, the Orionids produce between 10-20 meteors per hour, but because the full moon occurs on the 17th of that month, the waning gibbous moon phrase will interfere with the viewing of this shower. However, the Orionids run from Sept. 26 to Nov. 22 — a rather long duration — thus giving night sky observers opportunities to catch these super-streaking meteors that occasionally produce bright fireballs. Watch for Orionid meteors on the mornings of Oct. 20 and 21, right after midnight and until dawn. The radiant centers on the Orion constellation, easily identifiable by the straight line of stars that form Orion’s belt, and is highest in the sky around 2 a.m.

For more information about stargazing and meteor- shower watching opportunities, visit the American Meteor Society website at amsmeteors. org. For information about Dark Sky Texas, visit idatexas.org.

Happy wishing!"
Perseid meteor shower 2024 peaks this weekend.,https://www.msn.com/en-in/news/other/meteor-shower-know-when-and-how-to-see-the-perseids-at-their-best/ar-AA1ogXEX?ocid,
