Headlines,Links,ArticleBodyText
"2 months after Starliner launched, astronauts still haven’t returned.",https://www.usatoday.com/story/news/nation/2024/08/05/meteorites-bombarded-moon-atmosphere-exosphere/74675778007/,"The moon may not have any breathable air, but that doesn't mean it has no atmosphere.

Astronomers have for decades been aware of the delicate atmosphere surrounding the moon that is so thin and fragile that it's better referred to as an exosphere. And while scientists have long been stumped as to how that exosphere has managed to hang on, one team of researchers believes they finally have an answer.

Turns out, our planet's singular natural satellite can thank the longevity of its exosphere to the space rocks that have reliably ""bombarded"" it throughout its 4.5 billion-year history, the team wrote in research published this month.

First it was massive meteorites that routinely crashed into the pock-marked moon. More recently, however, it's been smaller, dust-sized “micrometeoroids” that have been constantly colliding into the lunar surface – kicking up soil and lofting up vaporized atom particles into the air in a process the researchers call, ""impact vaporization.""

Some of those atoms are ejected into space. But, crucially, enough of them remain suspended over the moon to sustain its exosphere long enough for more meteorites to pelt the surface, according to the research.

""The (moon's) surface has been continuously bombarded by meteorites,"" lead authorer Nicole Nie, a geochemist at the Massachusetts Institute of Technology, said in a statement. ""We show that eventually, a thin atmosphere reaches a steady state because it's being continuously replenished by small impacts all over the moon.""

Starliner timeline:2 months after Starliner launched, astronauts still haven’t returned

LADEE orbiter provides data on moon's exosphere

The moon's heavily cratered surface serves as a testament to how the celestial object has become a figurative magnet for space rocks throughout its long lifespan.

But it wasn't until a NASA lunar orbiter investigated the moon in 2013 that astronomers began to suspect that the exosphere's existence depends on those space rock assaults. The team meticulously studied data from the orbiter, called the Lunar Atmosphere and Dust Environment Explorer (LADEE,) which ultimately spent seven months gathering intel about the moon's atmosphere and conditions near the surface.

Based on LADEE's discoveries, scientists have theorized that two processes could be behind shaping the lunar atmosphere: impact vaporization and “ion sputtering,"" a phenomenon in which solar wind carries energetic charged particles from the sun through space. When these particles hit the moon’s surface, they can transfer their energy to the atoms in the soil and flinging those atoms into the air.

The new analysis that Nie and her colleagues performed led them to confirm that both processes are indeed playing a role.

""During meteorite showers, you see more atoms in the atmosphere, meaning impacts have an effect,"" Nie said in a statement. ""But it also showed that when the moon is shielded from the sun, such as during an eclipse, there are also changes in the atmosphere's atoms, meaning the sun also has an impact.""

Team studies lunar soil from Apollo missions

To determine which process bears more responsibility for the moon's exosphere, the team turned to soil samples collected by astronauts in the Apollo lunar program, which came to an end in 1972.

While studying the samples, the researchers were primarily looking for two elements both known to occur on the moon: potassium and rubidium. Because both elements are easily vaporized, the team reasoned that an analysis of their isotopes – variations of the same elements – would allow them to conclude whether meteorite strikes or solar sputtering contributed more to the moon's atmosphere.

Ultimately, the team determined that the soils contained mostly heavy isotopes of both potassium and rubidium. This told them impact vaporization was the most pivotal process in vaporizing atoms and ejecting them into the moon's atmosphere.

Could other celestial bodies exhibit a similar process?

The findings, the team contends, have implications far beyond determining the moon's atmospheric origins.

In fact, it's not unthinkable that similar processes could potentially be taking place at other celestial bodies in the solar system, including asteroids and other moons, said Justin Hu, a geophysicist at Cambridge University studying lunar soils, who was not part of the study.

“Without these Apollo samples, we would not be able to get precise data and measure quantitatively to understand things in more detail,” Nie concluded. “It’s important for us to bring samples back from the moon and other planetary bodies, so we can draw clearer pictures of the solar system’s formation and evolution.”

The team's research was published Friday in the journal Science Advances.

Eric Lagatta covers breaking and trending news for USA TODAY. Reach him at elagatta@gannett.com"
Perseid meteor shower 2024 peaks this weekend.,https://www.space.com/perseid-meteor-shower-2024-peak,"Every August, just when many people go vacationing in the country where skies are dark, the best-known meteor shower makes its appearance: The Perseids.

This year, the Perseid meteor shower should reach its peak during the overnight hours of late Sunday night into early Monday morning (Aug. 11-12), when there is almost no moon, making the late-night sky nice and dark for shooting star spectators and counters. The first quarter moon sets around 11:20 p.m. local daylight time, leaving the sky nicely dark thereafter. Some Perseids do appear during the evening, but the shower is always better from about 11 p.m. or midnight until the dawn's early light.

Or, to put it another way, expect greater numbers of meteors to be evident during the pre-dawn hours because this is when your side of Earth turns to face the oncoming meteors more directly.

If you want more advice on how to photograph meteor showers like the Perseids, check out our how to photograph meteors and meteor showers guide and if you need imaging gear, consider our best cameras for astrophotography and best lenses for astrophotography.

Where to look

During those after-midnight hours the shower's radiant point (the point from which it appears to originate), located between the Perseus constellation and the 'W' of Cassiopeia, will be getting progressively higher in the northeast — so meteors should flash across all parts of the sky at a rate of about one every minute or two (as seen by a single observer).

That, anyway, is the prediction if your sky is good and dark. But even if you live under moderate light pollution, as unfortunately, most of us do, you can catch at least the brightest of the Perseids. They have often been described in astronomy journals as including ""many bright and fragmenting meteors"" that leave persistent trains in their wake.

The stars of the Cassiopeia and Perseus constellations.I was having a convo with someone last week, maybe Josh about all this (Image credit: TheSkyLive.com)

Earth should go through the thickest part of this ""old faithful"" of meteor showers for many hours centered around 1400 UTC on Aug. 12, which is 10 a.m. on that date Eastern Daylight Time, which is during the daytime across all of North America. So, for meteor watchers here, the night before and perhaps even after could be equally good. Fortunately, the Perseids stay active — about one-quarter their peak strength — for several days before and a day or two after their peak, and an occasional one may be seen almost anytime during the month of August.

Get the Space.com Newsletter Breaking space news, the latest updates on rocket launches, skywatching events and more! Contact me with news and offers from other Future brands Receive email from us on behalf of our trusted partners or sponsors

A Perseid is one whose path, if traced backward across the sky, intersects a spot between the constellations Perseus and Cassiopeia. Other ""sporadic"" meteors traveling in random directions occur once every 5 or 10 minutes. Two much weaker showers are also active at this time of the year, the Delta Aquarids and Kappa Cygnids.

Lay back, relax, and wait

You'll need no experience to watch the Perseids. Just find a spot with a wide-open sky view and no late-night lights nearby. Bundle up warmly (it can sometimes get chilly even on summer nights), lie back on a ground pad or in a sleeping bag or even better, on a reclining lawn chair, and watch the stars. Also cover exposed parts of your body with mosquito repellent so you won't get bit.

Be patient, and give your eyes sufficient time to dark adapt. The direction to watch is not necessarily toward Perseus but wherever your sky is darkest, probably straight up.

The Perseids are the ionization trails made by little bits of debris from comet 109/P Swift-Tuttle, streaking into Earth's upper atmosphere at 37 miles (60 km) per second. The Perseids were especially dramatic in the early-to-mid 1990s surrounding the year of Swift-Tuttle's most recent return (in December 1992). Since then, however, they've reverted to normal. The comet isn't due back until August in the year 2126.

Startling occurrences

But surprises can always happen.

On the morning of Aug. 14, 2021, the Perseids displayed an unexpected outburst of meteors between 06:00 and 09:00 UT (2 to 5 a.m. EDT). The cause of this outburst is currently unknown but is probably the result of an unknown filament of comet debris produced by Swift-Tuttle as it raced through the inner solar system many centuries ago.

In an announcement on Central Bureau for Astronomical Telegrams Circular #5016 , the maximum zenithal hourly rate was estimated to be somewhere between 130 and 210, plus or minus 20. Amazing numbers considering that rates are normally 50% lower each preceding night after maximum but these rates are two to three times more than was seen during the expected maximum on the night of Aug. 12-13, 2021.

Four years from now ""might"" bring a truly amazing Perseid display, as some meteor experts are predicting that Earth will interact with a thick knot or clump of meteoric material shed by comet Swift-Tuttle during the 15th century, that possibly could produce a short-lived display of many hundreds of meteors per hour.

Perseid meteors streak over sky on Aug. 13, 2021 in Golog Tibetan Autonomous Prefecture, Qinghai Province of China. (Image credit: Jia Jiqian/VCG via Getty Images)

Defying predictions

Sometimes, even in years that are deemed favorable for Perseid viewing, sky watchers report seeing only a half or a third as many meteors that were predicted — and yet others report up to twice as many! It has been suggested that the stream of Perseid particles, strung out along its orbit around the sun, has a complex filamentary structure with gaps and rich spots.

Complicating the situation is the fact that some people's eyes seem better suited for meteor work than others.

Regardless of your local viewing circumstances, each year the appearance of the Perseids give many people a reason to head outside and gaze upward at the night sky. Even if you see only a few ""shooting stars,"" all it takes is catching sight of one outstandingly bright meteor to make the viewing experience worthwhile.

A final incentive is to note that next year the moon will be at a waning gibbous phase only a few days past full and will flood the sky with bright light, squelching all but the brightest Perseid streaks. So, take advantage of the favorable conditions provided to us this year.

To one and all we wish good luck and clear skies!"
Perseid meteor shower 2024 peaks this weekend.,https://www.livescience.com/space/meteoroids/the-perseid-meteor-shower-is-about-to-peak-heres-when-to-see-the-most-shooting-stars,"An outburst of Perseid meteors lights up the sky in this time-lapse image. Next week's Perseid meteor shower will be visible overnight on Aug. 11 and Aug.12.

One of the most prolific annual meteor showers of the year, the Perseids, will peak next weekend, bringing up to 75 ""shooting stars"" per hour to the sky Sunday night and early Monday (Aug. 11 to Aug. 12).

Although bright meteors are expected, the display can be significantly affected by strong moonlight. But this year, the moon will set just as strong activity begins to occur from the Perseids, according to the American Meteor Society . The best time to look will be after 1 a.m. local time on Monday, Aug. 12.

Shooting stars are caused by meteoroids . As these tiny particles enter Earth's atmosphere, they heat up and vaporize, releasing energy visible as streaks of light in the night sky. The Perseids move at a swift 37 miles per second (60 kilometers per second), and there are typically between 50 and 75 visible each hour during the peak night. That’s about one per minute, though you'll need to be as far away from light pollution as possible to see an impressive number of shooting stars.

Related: The 1st week of August is a stargazer's delight. Here's why.

The Perseid meteor shower is known for its fast and bright meteors, according to NASA . The meteors appear to emanate from the constellation Perseus, which is how they get their name. This constellation will rise high in the northwestern sky in the Northern Hemisphere in the hours after midnight, when the most shooting stars are expected to be seen. Also visible in this region of the sky is the Andromeda Galaxy, above Perseus, and the Pleiades, above Mars and Jupiter.

Although next weekend's peak offers the highest frequency of meteors, the Perseids are active from July 14 to Sept. 1, 2024, and ""shooting stars"" can be seen every night.

The visibility of shooting stars depends a lot on the moon's phases . Luckily, on Monday, Aug. 12, a half-lit moon will set about an hour after midnight local time across the Northern Hemisphere, meaning no strong moonlight will interfere with the peak of the Perseids this year. A clear, dark sky is required to see the meteors.

Sign up for the Live Science daily newsletter now Get the world’s most fascinating discoveries delivered straight to your inbox. Contact me with news and offers from other Future brands Receive email from us on behalf of our trusted partners or sponsors

Stargazing binoculars and backyard telescopes are not recommended for seeing meteor showers, as you'll want to let your eyes take in the whole sky to search for shooting stars. However, you'll want to have your stargazing gear ready for other night sky events this year, including planetary conjunctions, supermoons and potentially a very rare comet flyby."
Perseid meteor shower 2024 peaks this weekend.,https://www.lonestarlive.com/news/2024/08/perseid-meteor-shower-2024-peak-when-is-it-and-how-to-get-the-best-view.html,"Conditions should be favorable this year to view the peak of the Perseid meteor shower, which is widely considered to be the best meteor shower of the year.

The Perseid meteor shower will reach its peak the evening of Aug. 11 to 12, with good viewing conditions for a few days on either side of the peak. Skywatchers who look up during the pre-dawn hours could see an average of 50 to 100 meteors, according to NASA.

While the moon will be 44% full on the peak evening, it will set around midnight, leaving the skies dark until dawn and providing ideal viewing conditions for meteor watching.

The Perseid meteor shower, commonly known as the Perseids, is visible annually from mid-July to late August.

The Perseids result from Earth passing through bits of ice and rock left behind by Comet Swift-Tuttle, which last passed close to Earth in 1992.

During the peak around Aug. 11-12, Earth travels through the densest and dustiest part of the comet’s debris. In years without moonlight, the meteor rate appears higher. There can also be outburst years, such as in 2016, when the rate can reach 150 to 200 meteors per hour.

A typical Perseid meteoroid moves at 37 miles per second when it hits Earth’s atmosphere. With swift and bright meteors, Perseids frequently leave long “wakes” of light and color behind them as they streak through Earth’s atmosphere, according to NASA.

The Perseids are also known for their fireballs, which originate from larger particles of cometary material and are brighter than other meteors. Fireballs are larger explosions of light and color that can persist longer than an average meteor streak.

Meteor showers are named after the constellation from which the meteors appear to emanate. From Earth’s perspective, the Perseids’ radiant appears to come approximately from the direction of the Northern Hemisphere constellation Perseus.

How to view Perseid meteor shower

The Perseids are best viewed in the Northern Hemisphere during the pre-dawn hours before the sun rises, though at times it is possible to view meteors from this shower as early as 10 p.m.

Viewing a meteor shower is easy. All you need to catch the show is darkness, somewhere comfortable to sit and a bit of patience. Binoculars and telescopes aren’t needed since you’ll want the widest view of the sky possible.

The Perseids have the bonus of occurring during the summer months in the Northern Hemisphere, meaning you won’t have to bundle up when venturing out.

To best see the Perseids, go to the darkest possible location and lean back and relax. Get away from as much light pollution as possible and be sure to allow about 30 minutes for your eyes to adjust to the dark.

Although meteors can come from any direction, you’ll want to generally orient yourself to look to the north toward the Perseus constellation. Though Perseus isn’t the easiest to find, it conveniently follows the brighter and more distinctive constellation Cassiopeia across the night sky."
Perseid meteor shower 2024 peaks this weekend.,https://www.space.com/venus-earthshine-perseid-meteor-shower-peak-night-sky-this-week,"Find out the latest naked-eye night sky events and how to see them.

From views of a brightening Venus after sunset and the appearance of a beautiful crescent moon to the peak of the annual Perseid meteor shower, there is much to see this week (Aug. 5 to Aug. 11) using just your naked eyes.

A good telescope or pair of binoculars will help you see some of the night sky’s fainter objects. However, the unaided eye is enough to learn its stars and constellations , watch the moon , experience meteor showers and see satellites whizz across the night sky.

Read on to find out what you can see in the night sky this week without any equipment, from the moon close to planets and bright stars to catching the ever-changing moon phases , shooting stars and much more.

MONDAY, AUG. 5 — CRESCENT MOON AND VENUS (AFTER SUNSET)

A 2%-illuminated crescent moon will be a challenging sight after sunset, but Venus will help. (Image credit: Starry Night)

Look to the west immediately after the sun has set, and you will see Venus shining very close to a super-slim crescent moon. This will be a challenging sight since the sky will still be relatively bright as the pair sinks close to the horizon.

TUESDAY, AUG. 6 — CRESCENT MOON AND VENUS (AFTER SUNSET)

Look to the west after sunset to see a slim crescent moon and Venus. (Image credit: Starry Night)

A waxing crescent moon will shine due west after sunset. It will no longer be close to Venus, but look to the moon’s lower right, and you’ll see the sixth-largest planet in the solar system shining brightly in its new apparition as the "" Evening Star ."" Over the next few nights, the moon will get brighter as it gets further from Venus, which will climb higher into the post-sunset sky until January, growing brighter as it seeps into a later, darker twilight.

WEDNESDAY, AUG. 7 — CRESCENT MOON, VENUS AND SPICA (AFTER SUNSET)

A waxing crescent moon will be visible between Venus and the bright star Spica. (Image credit: Starry Night)

A brighter, more obvious crescent moon will tonight be positioned about halfway between Venus, to its lower right, and bright star Spica, to its upper left. One of the 20 brightest stars in the night sky, Spica is the brightest star in the constellation Virgo .

THURSDAY, AUG. 8 — CRESCENT MOON, VENUS AND SPICA (AFTER SUNSET)

Look for “Earthshine” on the waxing crescent moon as it moves between Venus and Spica. (Image credit: Starry Night)

Here's another chance to see the crescent moon dominating the post-sunset evening sky, with Venus shining stubbornly close to the western horizon. Look at the moon's dark left side. Can you make out any details? Since no sunlight shines directly on it, it should be dark, right?

Get the Space.com Newsletter Breaking space news, the latest updates on rocket launches, skywatching events and more! Contact me with news and offers from other Future brands Receive email from us on behalf of our trusted partners or sponsors

Earthshine is caused by sunlight reflecting from Earth onto the moon. (Image credit: Alan Dyer/Stocktrek Images via Getty Images)

The light you can see is called ""Planet-shine,"" ""Earthshine,"" or ""Da Vinci Glow."" It's sunlight shining on Earth and reflecting onto the moon. It's easiest to see in a crescent moon a few days old.

FRIDAY, AUG. 9 — SATURDAY, AUGUST 10 - CRESCENT MOON, SPICA, ANTARES AND THE MILKY WAY (AFTER SUNSET)

Visible for about two hours after sunset will be a crescent moon close to Spica. (Image credit: Starry Night)

About a quarter of the moon's Earth-facing side is now lit by the sun. Across two nights, it will appear on either side of Spica. Arcturus in the constellation Boötes will appear directly above the pair, while to the south, the Milky Way will rise after dark. However, to see the arc of our galaxy, you'll need to be well away from light pollution.

SUNDAY, AUG. 11 — MONDAY, AUG. 12: PERSEID METEORS PEAK (PRE-DAWN)

The constellation Perseus rises in the northwest in the early hours of Aug. 12 as the Perseid meteor shower peaks. (Image credit: bingdian via Getty Images)

It may not be the most prolific meteor shower of the year (that distinction goes to December's Geminids and January’s Quadrantids ), but there's no better time to see shooting stars from the northern hemisphere than tonight. At its peak, the annual Perseid meteor shower can produce around 60 meteors per hour visible in the night sky. The radiant point (where the meteors will appear to emanate from) will be the constellation Perseus , which will rise in the northeastern sky around midnight.

Meteor showers can often be marred by strong moonlight, but not so the Perseids this year since the First Quarter Moon will set around midnight. Look skywards during the early hours of Monday for the best chance of shooting stars, though light pollution and the clarity of the sky will make a huge difference. If you can, get away from light pollution — at least 40 miles from a major urban area is wise — but wherever you watch from, make sure don’t have any artificial lights in your line of sight. Sit back, relax in a lawn chair, keep warm, and take regular breaks. Never look at your smartphone; its white light will ruin your eyes’ dark adaption, which takes about 20 minutes to cultivate and just a single second of white light to ruin.

Want to try your hand at capturing some of these events with a camera? Check out our guide on astrophotography for beginners . If you don't have everything you need, be sure to see our guides on the best cameras for astrophotography and the best lenses for astrophotography .

Jamie Carter is the author of Stargazing in 2024 and A Stargazing Program For Beginners .

Editor's note: If you have an amazing skywatching photo and would like to share it with Space.com's readers, send your photo(s), comments, and your name and location to spacephotos@space.com."
