Headlines,Links,ArticleBodyText
Cardi B Reveals She Had a 'Freak Accident' That Left Her with a 'Freak Accident'.,https://www.etonline.com/cardi-b-says-a-freak-accident-almost-caused-a-miscarriage-and-left-her-briefly-paralyzed-230204,"Cardi B said she suffered an undisclosed medical diagnosis that nearly cost her her baby's life and left her briefly paralyzed.

The ""Like It"" rapper shared the ordeal while chatting with her fans during an X Spaces conversation, in which she said that the ""freak accident"" left her in immense pain. Cardi B, 31, is pregnant with her third child amid her divorce proceedings with estranged husband, Offset.

""I had a f***ing freak accident. I don't know how something, well, it wasn't little. It actually hurt,"" she shared on X Spaces. ""It doesn't really happen often, but it became something that is so big to the point I was literally paralyzed. But yeah. And that little thing almost cost me my little one to come. But it didn't. Yesterday I was feeling good. I came home, but I came home high as a kite. Today, I woke up sober, honey. I'm dying. Like, I'm dying. I swear to God, if I don't feel good in four hours I'm going to the hospital and I don't give a f**k. I'mma exaggerate this s**t so I can get more morphine. Morphine me down! I don't give a damn [laughs]. Oh my God.""

Cardi and the former Migos rapper share two other children -- daughter Kulture, 6, and son Wave, 2. Offset is also father to Jordan, 13, and Kalea and Kody, both 8, from previous relationships.

Cardi B announced earlier this month that she's pregnant with her third child. The GRAMMY winner took to Instagram and shared a photo of her baby bump, with the New York City skyline serving as her backdrop.

""With every ending comes a new beginning! I am so grateful to have shared this season with you, you have brought me more love, more life and most of all renewed my power,"" Cardi captioned the post featuring two images of her cradling her baby bump in a revealing red dress.

She added, ""Reminded me that I can have it all! You've reminded me that I never have to choose between life, love, and my passion! I love you so much and can not wait for you to witness what you helped me accomplish, what you pushed me to do! It's so much easier taking life's twists, turns and test laying down, but you, your brother and your sister have shown me why it's worth it to push through!""

The announcement came amid her divorce filing from Offset. The former couple privately tied the knot in 2017. Their up-and-down marriage came to a head back in December when Cardi B confirmed speculation that they had separated.

Cardi B had previously filed for divorce twice before calling it off.

RELATED CONTENT:"
Cardi B Reveals She Had a 'Freak Accident' That Left Her with a 'Freak Accident'.,https://www.dailymail.co.uk/tvshowbiz/article-13725183/Cardi-B-accident-PREGNANCY-LOSS-paralyzed-hurt.html,"After announcing her third pregnancy, Cardi B is opening up about a near-fatal health scare that almost cost her her recently announced pregnancy.

The Grammy Award winner, 31, revealed in a recent X Spaces chat that she 'had a f***ing freak accident' that temporarily left her paralyzed.

'That's what I have to explain here,' she prefaced. 'Because I don't know how something — well it wasn't little, it actually hurt…'

Although she didn't specify the nature of her illness, Cardi noted that it's something she's experienced before.

'It doesn't really happen often,' she said. 'It became something so big to the point I was literally paralyzed. And that little thing almost cost me my little one to come. But it didn't.'

Cardi B revealed in a recent X Spaces chat that she 'had a f***ing freak accident' that left her paralyzed and almost cost her her recently announced pregnancy

'That's what I have to explain here,' she prefaced. 'Because I dont know how something — well it wasn't little, it actually hurt…'; pictured June 21 in Beverly Hills

Cardi added that she's since returned home from the hospital, but she's still in pain.

'Yesterday, I was feeling good because I came home, but I came home high as a kite,' she said. 'Today, I woke up sober. Honey, I'm dying. I'm dying.

'I swear to God, if I don't feel good in four hours, I'm going to the hospital,' added Cardi.

'And I don't give a f***, I'm gonna exaggerate this s*** so I can get more morphine. Morphine me down, I don't give a damn.'

The Invasion Of Privacy artist announced her third pregnancy last week on Instagram with some stunning maternity photos in a red dress.

'With every ending comes a new beginning!' she wrote in the post. 'I am so grateful to have shared this season with you, you have brought me more love, more life and most of all renewed my power!

'Reminded me that I can have it all! You've reminded me that I never have to choose between life, love, and my passion! I love you so much and can not wait for you to witness what you helped me accomplish, what you pushed me to do!'

Cardi continued, 'It's so much easier taking life's twists, turns and tests laying down, but you, your brother and your sister have shown me why it’s worth it to push through!'

'It doesn't really happen often,' she said of the mysterious illness. 'It became something so big to the point I was literally paralyzed. And that little thing almost cost me my little one to come. But it didn't'; pictured June 28 in LA

The Invasion of Privacy artist announced her third pregnancy last week on Instagram with some stunning maternity photos in a red dress

The same day, Cardi filed for divorce from husband Offset amid rumors that he had cheated. She's seeking primary custody of their six-year-old daughter Kulture and two-year-old son Wave



The same day, Cardi filed for divorce from husband Offset amid cheating rumors, seeking primary custody of their six-year-old daughter Kulture and two-year-old son Wave.

In her divorce papers, Cardi confirmed that Offset, 32, is the father of her unborn baby.

A source has since told People that the divorce is 'not based on cheating rumors, but rather has been a long time coming.'

The insider added, 'We've seen them break up, get back together, break up, get back together, and we just want her to stick to her decision and just enjoy her f***ing life.'"
Cardi B Reveals She Had a 'Freak Accident' That Left Her with a 'Freak Accident'.,https://perezhilton.com/cardi-b-freak-accident-nearly-caused-miscarriage/,"Cardi B suffered a terrifying “freak accident” which almost cost her the life of her baby!

Last week, the WAP rapper shocked fans by announcing she’s pregnant with baby #3 — just hours after it was revealed she had filed for divorce from husband Offset. And amid all the chatter, she nearly suffered a miscarriage.

Related: Lea Michele Suffered ‘Back-To-Back’ Miscarriages Before Conceiving Baby No. 2

The 31-year-old spoke to fans during a Spaces conversation on X (Twitter) earlier this week and opened up about a scary “freak accident” that left her briefly “paralyzed” and nearly made her miscarry. WHOA!

She told listeners:

“I had a f***ing freak accident. I don’t know how something, well, it wasn’t little. It actually hurt. It doesn’t really happen often, but it became something that is so big to the point I was literally paralyzed. But yeah. And that little thing almost cost me my little one to come. But it didn’t.”

That’s TERRIFYING!

While she didn’t specify the exact nature of the “freak accident,” she did talk about how painful it’s been:

“Yesterday I was feeling good. I came home, but I came home high as a kite. Today, I woke up sober, honey. I’m dying. Like, I’m dying. I swear to God, if I don’t feel good in four hours I’m going to the hospital and I don’t give a f**k. I’mma exaggerate this s**t so I can get more morphine. Morphine me down! I don’t give a damn. Oh my God.”

Listen to the full audio clip (below):

Cardi B talks about getting in a freak incident which led her to be hospitalized and on morphine. pic.twitter.com/FmHmg8raUu — ✨GOT DA SCOOP✨ (@GotDaScoop) August 6, 2024

Poor Cardi! We’re just grateful she and her baby are OK now… We’re sending healing energy her way!

[Images via Cardi B/YouTube & MEGA/WENN]"
Cardi B Reveals She Had a 'Freak Accident' That Left Her with a 'Freak Accident'.,https://www.geo.tv/latest/558260-cardi-b-shares-freak-accident-that-nearly-caused-pregnancy-loss,"Cardi B shares 'Freak Accident' that nearly caused pregnancy loss

Cardi B revealed that she faced an accident that left her ‘paralyzed’



The 31-year-old rapper shared in a recent X Space chat that she experienced an intense medical scare

While speaking to fans she revealed that she had a ‘Freak accident that could have potentially harmed her pregnancy.

The I Like It singer said without specifying the incident, “I had a f–king freak accident. I don’t know how something — well, it wasn’t little, it actually hurt.”

“It doesn’t really happen often, but it become [sic] so big to the point I was literally paralyzed,"" she said, adding, ""And that little thing almost cost me my little one to come.""

Luckily, ""it didn’t,"" she announced. ""Yesterday I was feeling good. I came home, but I came home high as a kite.”

Moreover, Cardi updated her fans about her health saying, ""Today, I woke up sober, honey. I’m dying, If I don’t feel good in four hours, I’m going to the hospital and I don’t give a f---.""

""I’mma exaggerate this s--- so I can get more morphine. Morphine me down! I don’t give a damn,"" she laughingly added.

For those unversed, Cardi announced her third pregnancy on her official Instagram account on August 1, one day after she filed for divorce from her estranged husband Offset.

The two also share a 6-year-old daughter Kulture and a 2-year-old son Wave."
Cardi B Reveals She Had a 'Freak Accident' That Left Her with a 'Freak Accident'.,https://people.com/pregnant-cardi-b-new-details-accident-couldnt-move-for-days-8692894,"Cardi B is sharing new details about a recent medical scare.

In a conversation on X Spaces on Thursday, Aug. 8, the pregnant rapper, 31, described exactly how she felt ""paralyzed"" and ""couldn't move for two days straight"" after previously sharing that she had a ""freak accident"" that almost led to a pregnancy loss.

""I was going down the stairs and I slipped a little,"" the ""I Like It"" singer explains. ""I practically fell, but I was trying to prevent myself from falling, so I was holding myself on the railing. My foot still slipped, and I kind of busted my ass.""

Never miss a story — sign up for PEOPLE's free daily newsletter to stay up-to-date on the best of what PEOPLE has to offer, from juicy celebrity news to compelling human interest stories.

Cardi B. Jeff Kravitz/FilmMagic

She adds that upon falling, ""I felt a weird jerk, like a pop, and I couldn't get up really.""

After ""screaming"" for her dad, he ran over and ""tried helping me get up and move out the steps."" Despite his efforts, Cardi shares, ""I noticed that I couldn't really walk, like I was feeling pain in my, I don't know, in the lower of my stomach.""

Cardi notes that she's carrying her soon-to-be baby ""a little low,"" so she's used to feeling ""a little pain"" in that region and just decided to take a nap after the fall.

However, Cardi says, ""When I woke up, I couldn't move my bottom at all. Like, just moving my feet was hurting the bottom of my stomach. I couldn't move. I felt like paralyzed.""

The PEOPLE Puzzler crossword is here! How quickly can you solve it? Play now!



Cardi B and Offset in Los Angeles in February 2019. Francis Specker/CBS via Getty

Unable to move and starting to panic, the singer took an ambulance to the hospital where she ""found out that I tore a ligament in my pelvis and it's right where my baby's head is at.""

""I dilated and I was having contractions for every two minutes for a whole 24 hours,"" the soon-to-be mom of three continues. ""So they had to monitor me and I was in a lot of pain. I couldn't move for two days straight.""

Cardi adds that eventually the doctors ""sent me home,"" and they ""not only put me on bed rest, but I got to do therapy.""

""So stop playing with me. I'm not even a type of person to exaggerate anything,"" she tells those who criticized her for previously asking for more morphine from the hospital. ""You don't even know what the f--- is going on or what I'm going through.""

Cardi initially announced her pregnancy news on Instagram on Thursday, Aug 1, just one day after she filed for divorce from husband Offset, 32, after six years of marriage. The former couple shares son Wave Set, 2½, and daughter Kulture Kiari, 6.

"
Cardi B Reveals She Had a 'Freak Accident' That Left Her with a 'Freak Accident'.,https://whatstrending.com/cardi-b-reveals-freak-accident-nearly-leaving-her-paralyzed-amid-pregnancy-news/,"Cardi B recently shared a harrowing medical scare with her fans, shedding light on a serious incident she experienced shortly after announcing her third pregnancy.

The 31-year-old rapper took to X Spaces to discuss the situation, which she described as a “freak accident.” Cardi B, known for her hit songs and vibrant personality, revealed that the incident left her briefly “paralyzed” and posed a serious risk to her unborn child. She detailed the experience without specifying exact details or a formal diagnosis.

“I had a freak accident. I don’t know how something—well, it wasn’t little, it actually hurt,” Cardi B said. “It doesn’t really happen often, but it became so big to the point I was literally paralyzed. And that little thing almost cost me my little one to come.”

Fortunately, Cardi B reported that the situation did not result in a miscarriage. She explained that she was feeling better the following day. “Yesterday, I was feeling good. I came home, but I came home high as a kite,” she said. Cardi added that she planned to seek medical attention if her condition did not improve within a few hours. “I’mma exaggerate this so I can get more morphine. Morphine me down! I don’t give a damn,” she joked, reflecting her light-hearted approach to coping with the pain.

Cardi B’s announcement about her pregnancy came on August 1, just one day after she filed for divorce from her husband, Offset. The couple, who had been married for six years, share two children: son Wave Set, 2½, and daughter Kulture Kiari, 6. The pregnancy news came as a significant development amid her personal and legal challenges.

In her Instagram post announcing her pregnancy, Cardi B shared a series of photos in a red dress that highlighted her baby bump. “With every ending comes a new beginning! I am so grateful to have shared this season with you,” she wrote in the caption. “You have brought me more love, more life, and most of all renewed my power!” Cardi B expressed her gratitude and excitement about the new chapter in her life.

She continued, “Reminded me that I can have it all! You’ve reminded me that I never have to choose between life, love, and my passion! I love you so much and cannot wait for you to witness what you helped me accomplish, what you pushed me to do!”

ADVERTISEMENT

In her post, Cardi B also reflected on the challenges she has faced, stating, “It’s so much easier taking life’s twists, turns, and tests lying down, but you, your brother, and your sister have shown me why it’s worth it to push through!”

Cardi B’s candidness about her medical scare underscores the complexities of navigating personal health and public life, especially during a time of significant change. Her ability to blend humor with vulnerability continues to resonate with her fans, who have followed her journey through both triumphs and tribulations."
Cardi B Reveals She Had a 'Freak Accident' That Left Her with a 'Freak Accident'.,https://www.thenews.com.pk/latest/1218050-cardi-b-reveals-freak-accident-that-paralysed-her-amid-pregnancy,"Cardi B announced her pregnancy just a day after filing for divorce from Offset

Cardi B is opening up about a frightening health scare that almost jeopardised her pregnancy.

During a chat on X Spaces, the 31-year-old rapper — who is expecting her third child with estranged husband Offset — revealed she experienced a ""freak accident"" that temporarily left her ""paralysed"" and nearly led to a pregnancy loss.

“I had a f***ing freak accident. I don’t know how something — well, it wasn’t little, it actually hurt,” Cardi shared, without delving into specifics.

The Bodack Yellow hitmaker explained that the incident grew serious enough to cause temporary paralysis, putting her unborn baby at risk.

“And that little thing almost cost me my little one to come,” she reflected.

Thankfully, Cardi reassured fans that she and her baby are now okay.

“Yesterday I was feeling good. I came home, but I came home high as a kite,” she admitted, maintaining her signature sense of humour despite the ordeal.

“Today, I woke up sober, honey. I’m dying. If I don’t feel good in four hours, I’m going to the hospital and I don’t give a f***,” she quipped, adding, “Imma exaggerate this s*** so I can get more morphine.”

“Morphine me down! I don’t give a damn,” she demanded.

The news of Cardi’s health scare comes shortly after she announced her third pregnancy just a day after filing for divorce from Offset amid cheating speculations. The pair also share daughter Kulture Kiari, 6, and son Wave Set, 2."
Cardi B Reveals She Had a 'Freak Accident' That Left Her with a 'Freak Accident'.,https://www.music-news.com/news/UK/175730/Cardi-B-opens-up-about-freak-accident-that-left-her-temporarily-paralysed,"Cardi B opens up about 'freak accident' that left her temporarily 'paralysed'

Cardi B has opened up about a ""freak accident"" that left her temporarily ""paralysed"".

The rapper, who announced last week that she is pregnant with her third child, has revealed that she was recently involved in an accident that nearly resulted in a miscarriage.

Cardi opened up about the accident during a recent X Spaces chat with her fans.

""I had a f**king freak accident. I don't know how something - well, it wasn't little, it actually hurt,"" the WAP rapper began, according to a clip posted on social media. ""It doesn't really happen often, but it become so big to the point I was literally paralysed.""

Cardi continued, ""And that little thing almost cost me my little one to come. But it didn't. Yesterday I was feeling good. I came home, but I came home high as a kite.""

The 31-year-old then told fans that the painkillers soon wore off.

""Today, I woke up sober, honey. I'm dying. If I don't feel good in four hours, I'm going to the hospital and I don't give a f**k,"" she said. ""I'mma exaggerate this s**t so I can get more morphine. Morphine me down! I don't give a damn.""

Cardi did not specify the nature of the accident or the severity of her injuries.

The I Like It rapper's comments come days after she announced she was pregnant with her third child with rapper husband Offset.

On the same day, she confirmed that she had filed for divorce from Offset, with whom she also shares two other children, Kulture, six, and Wave, two."
Cardi B Reveals She Had a 'Freak Accident' That Left Her with a 'Freak Accident'.,https://www.nme.com/news/music/cardi-b-reveals-freak-accident-left-her-temporarily-paralysed-and-almost-caused-miscarriage-3782151,"Cardi B has opened up about a “freak accident” she had, which left her temporarily paralysed and almost caused miscarriage.

The rapper opened up about the past ordeal during a new appearance on social media, when she took to X Spaces shortly after revealing that she is pregnant with her third child.

While she didn’t go into specific details about the nature of the incident, she did confirm that the moment led to her needing emergency intervention.

“I had a fucking freak accident. I don’t know how — it wasn’t little, it actually hurt,” she told her fans while appearing live on the social media platform (via Billboard).

Advertisement

She didn’t confirm what the specific diagnosis was but did say it was rare and led to her being temporarily paralysed. “It doesn’t really happen often, but it became so big to the point I was literally paralysed.

“And that little thing almost cost me my little one to come. But it didn’t. Yesterday I was feeling good. I came home, but I came home high as a kite.”

She continued, “Today, I woke up sober, honey. I’m dying. If I don’t feel good in four hours, I’m going to the hospital and I don’t give a fuck. I’mma exaggerate this shit so I can get more morphine. Morphine me down! I don’t give a damn.”

Cardi B talks about getting in a freak incident which led her to be hospitalized and on morphine. pic.twitter.com/FmHmg8raUu — ✨GOT DA SCOOP✨ (@GotDaScoop) August 6, 2024

Recommended

The discussion came just days after the ‘Bongos’ rapper revealed that she is pregnant with her third child, amidst reports that she was filing for a divorce from Offset.

“With every ending comes a new beginning!” she said.

“I am so grateful to have shared this season with you, you have brought me more love, more life and most of all renewed my power! Reminded me that I can have it all! You’ve reminded me that I never have to choose between life, love, and my passion!

Advertisement

“I love you so much and can not wait for you to witness what you helped me accomplish, what you pushed me to do! It’s so much easier taking life’s twists, turns and test laying down, but you, your brother and your sister have shown me why it’s worth it to push through!”

Cardi B is also reportedly seeking “primary custody” of her two children with the musician, Kulture and Wave, with a source telling Page Six: “They’ve grown apart. That’s what drove her to this decision more than anything else. This is something she wants to do.”

Elsewhere, Cardi has become increasingly outspoken against Donald Trump in the US Presidential race – criticising the former US President and current Republican candidate for promising police immunity.

She also recently reminded fans that she endorsed Kamala Harris long before Joe Biden withdrew from the race."
Cardi B Reveals She Had a 'Freak Accident' That Left Her with a 'Freak Accident'.,https://allhiphop.com/news/cardi-b-reveals-unborn-babys-life-was-at-risk-following-freak-accident/,"Click to share on Pocket (Opens in new window)

Click to share on Tumblr (Opens in new window)

Click to share on LinkedIn (Opens in new window)

Click to share on Pinterest (Opens in new window)

Click to share on Reddit (Opens in new window)

Click to share on Facebook (Opens in new window)

Click to share on Telegram (Opens in new window)

Click to share on WhatsApp (Opens in new window)

Click to share on Twitter (Opens in new window)

Cardi B spent several days in hospital, revealing a “freak accident” left her paralyzed and her unborn baby’s life hanging in the balance.

Cardi B reveals she almost lost her unborn child in a freak accident that left her in excruciating pain and in hospital for days.

On Wednesday (August 7), less than a week after announcing her pregnancy, the “Wanna Be” hitmaker took to social media to update her fans. She hopped on X (Twitter) Spaces to reveal that she was back home after spending a few days in hospital.

“I had a f###### freak accident,” she explained. While Cardi B withheld the specific details of what led to her hospitalization, she added, “It become so big to the point I was literally paralyzed.”

She continued, revealing that her unborn baby was at risk during the terrifying ordeal. “And that little thing almost cost me my little one to come,” she said. “But it didn’t.”

While Cardi B is back at home and in good spirits, she’s struggling to cope with the pain.

“Yesterday I was feeling good. I came home, but I came home high as a kite,” Cardi added. “Today, I woke up sober, honey. I’m dying … If I don’t feel good in four hours, I’m going to the hospital and I don’t give a f###. I’ma exaggerate this s### so I can get more morphine. Morphine me down! I don’t give a damn.”

Elsewhere during the update, Cardi B said “a little freak accident” landed her a spell in the hospital for two or three days. “I’m in a lot of pain,” she added. “I don’t even know how the f### it happened … but I injured myself.”

Although Cardi is struggling with her injuries, she remains focused on her upcoming album. “You think I could record lying down?” she questioned. “Cuz I have so much things planned now.”

Cardi also wondered whether divine intervention was responsible for her hospitalization. The mother-of-two plans to release an album before the year is out. She also recently filed for divorce from husband Offset,

“I think God wanted me to sit down and calm down a little bit,” she mused, adding that she had been “doing too much” and “got a little bit too excited.”"
Cardi B Reveals She Had a 'Freak Accident' That Left Her with a 'Freak Accident'.,https://uk.news.yahoo.com/cardi-b-opens-freak-accident-213000281.html,"The rapper, who announced last week that she is pregnant with her third child, has revealed that she was recently involved in an accident that nearly resulted in a miscarriage. Cardi opened up about the accident during a recent X Spaces chat with her fans. ""I had a f**king freak accident. I don't know how something - well, it wasn't little, it actually hurt. It doesn't really happen often, but it become so big to the point I was literally paralysed."""
