Headlines,Links,ArticleBodyText
"ISIS-inspired suspect planned suicide attack at Taylor Swift concert, Austrian authorities say.",https://www.cnn.com/2024/08/08/europe/isis-inspired-suicide-terror-attack-taylor-swift-vienna-intl/index.html,"CNN —

Police in Austria have questioned three teenagers suspected of plotting a suicide attack at a Taylor Swift show, sparking renewed concerns over the indoctrination of young people online.

Foreign intelligence agencies helped authorities uncover the alleged scheme, according to the country’s Interior Minister Gerhard Karner. A source familiar told CNN that the US issued a warning to authorities in Vienna.

Organizers canceled three concerts, which were scheduled to take place in the European capital from Thursday to Saturday. CNN has reached out to Swift’s representatives for comment.

Investigators unearthed a stockpile of chemicals, explosive devices, detonators and 21,000 euros in counterfeit cash at the home of the main suspect, a 19-year-old ISIS sympathizer who had been radicalized online, according to authorities.

A screen displays a photo of a man arrested in connection with a suspected terror plot that caused the cancellation of the Vienna leg of a tour by American mega-star Taylor Swift. Roland Schlager/APA/AFP/Getty Images

The young man – who was arrested Wednesday morning in the eastern town of Ternitz – planned to kill himself and “a large number of people,” according to the head of the domestic intelligence agency, Omar Haijawi-Pirchner.

“He said he intended to carry out an attack using explosives and knives,” Haijawi-Pirchner told reporters in Vienna on Thursday. “His aim was to kill himself and a large number of people during the concert, either today or tomorrow.”

Two other suspects were detained, aged 17 and 15. The 17-year-old worked for a facilities company that would have provided services at the concert venue. He was near the stadium when he was arrested and had recently broken up with his girlfriend, according to Haijwai-Pirchner.

Little has been revealed about the 15-year-old. Prosecutors will decide later if he was a witness or directly involved in the alleged plot.

The three are all Austrian-born with either Turkish, North Macedonian or Croatian backgrounds.

The trio were in contact with other individuals who knew about the plan, said the country’s director general for public security, Franz Ruf. No one else is being sought in direct connection with the plot, Ruf added.

Austrian police officers watch Taylor Swift fans gather in Vienna, on August 8, after officials canceled the Austrian leg of the Eras Tour over a suspected terror plot. Heinz-Peter Bader/AP

The cancellations of the Swift concert triggered an outpouring of heartbreak, grief and relief among Swifties hoping to attend the record-breaking Eras Tour in Vienna. Hailed as a cultural phenomenon, the scale, influence and intricacy of Swift’s musical voyage have made headlines for boosting the economies of the cities she visits.

The show-stopping tour began in Glendale, Arizona in March 2023, and has been extended several times. Vienna was scheduled to be the penultimate venue of the European leg, with Swift set to play five nights at London’s Wembley Stadium over the next two weeks, before moving on to Canada in November and December.

London Mayor Sadiq Khan said the city would “carry on” with the scheduled events, telling Sky News: “I’m sure Vienna has got its own reasons to cancel the Taylor Swift concerts, we’re going to carry on, working closely with police (and) ensuring that the Taylor Swift concerts can take place in London safely.”

Swifties trade friendship bracelets, serenade each other

Fans of US mega-star Taylor Swift, so-called ""Swifties"" exchange beaded bracelets in Vienna, Austria, after her three scheduled concerts were canceled. Eva Manhart/AFP/Getty Images

A rush of excitement descended on the Austrian capital in the days leading up to the three-day fest, according to locals, with Swifties filling the cobbled streets and spontaneously breaking out into song.

Several fans who were planning to attend shows in Vienna told CNN they participated in a series of events Thursday that were staged in a community-led effort to rekindle the spirit and energy of the tour.

Footage has emerged of Swifties serenading each another at local squares in Vienna and trading personalized friendship bracelets – a concert tradition inspired by the lyrics on Swift’s song “You’re on Your Own, Kid” from her 10th studio album “Midnights.”

Julia Schnizlein, a pastor at the Lutheran City Church, told CNN that she bought tickets as a Christmas gift for her 14-year-old daughter, Leni, who was left heartbroken on Wednesday.

“We were really looking forward to the concert and have met a lot of fans over the last few days,” the 45-year-old said. “The whole city was full of happy, peaceful people exchanging bracelets and spontaneously singing together.”

Fourteen-year-old Leni, pictured at a Taylor Swift-themed sing along at the Stephansplatz square, in Vienna, on Thursday. Courtesy Julia Schnizlein

Julia Schnizlein, a 45-year-old pastor, hosted a sing along for disappointed fans, at the Lutheran City Church, on Thursday. Courtesy Julia Schnizlein

Instead, the pastor opened the doors of her church to host a Swift-themed singalong for fans. Social media videos show people bopping their heads to melodies of some of the Grammy-winning artist’s greatest hits – including “Blank Space” and “Style” – as music blares from the speakers of the hall, illuminated by the glow of yellow candles.

“People were crying, holding hands, singing along softly,” said Kristi Hovington, 46, who wandered into the chapel after hearing tunes from the Eras Tour setlist. “It was such a beautiful moment, a pocket of beauty amidst the disappointment and anger.”

The school librarian journeyed from Barcelona, Spain, to attend the tour with her 14-year-old daughter, Esme, who had dreamed of seeing Swift live in concert. “She cried for an hour, at least; this was her dream, to see Taylor.”

Fans of US mega-star Taylor Swift gather in the center in Vienna, Austria. Roland Schlager/APA/AFP/Getty Images

Elsewhere in the capital, dozens of fans congregated at the Stephansplatz, a central square, to belt out an array of Swift songs. One participant, Elie Fares, said he was “devastated” for fans who had lost their chance to see the US pop star on tour.

“I just walked right over and basked in the camaraderie of it all, the way it exuded a lot of joie de vivre, a giant middle finger to all of those who wanted the squash that joy and instil fear,” added the 34-year-old physician, who has attended shows in the US and Europe.

“Swifties have shown time and time again that they are a formidable community among music fans,” he told CNN on Thursday. “In the grand scheme of what’s happening around the world today, we are all aware of where a concert cancellation falls, but that doesn’t mean we can’t be supportive of each other.”"
"ISIS-inspired suspect planned suicide attack at Taylor Swift concert, Austrian authorities say.",https://apnews.com/article/austria-taylor-swift-concerts-canceled-extremism-arrests-17b494f1a164b205128d7faeb607e731,"VIENNA (AP) — Both suspects in a foiled plot to attack Taylor Swift shows in Vienna appeared to be inspired by the Islamic State group and al-Qaida, Austrian authorities said Thursday, and investigators found bomb-making materials at one of their homes. Officials said one of the two confessed to planning to “kill as many people as possible outside the concert venue.”

Three sold-out concerts were canceled Wednesday because of the plot, devastating Swifties from across the globe. Many of them had dropped thousands of euros (dollars) on travel and lodging in Austria’s expensive capital city to attend the Eras Tour shows at the Ernst Happel Stadium, which sat empty Thursday morning.

Europe is enamored with the American superstar: The German town of Gelsenkirchen renamed itself “Swiftkirchen” before its mid-July concerts.

Concert organizers in Austria said they had expected up to 65,000 fans inside the stadium at each concert and as many as 30,000 onlookers outside, where authorities said the suspects planned to strike. The foiled attack was planned for Thursday or Friday, according to Austria’s interior minister, Gerhard Karner.

Austrian Chancellor Karl Nehammer defended the decision to cancel the concerts, saying the arrests of the suspects took place too close to the shows, scheduled for Thursday, Friday and Saturday.

“I understand very well that those who wanted to experience the concert live are very sad,” Nehammer told a news conference Thursday. “Moms and dads are looking after their daughters and sons, who were full of enthusiasm and anticipation for this concert. But it’s also important that in such serious moments as now, it’s inevitable that safety comes first.”

Swift is also scheduled to perform at London’s Wembley stadium in five concerts between Aug. 15 and 20 to close the European leg of her record-setting Eras Tour.

London Mayor Sadiq Khan said that while he understood Vienna’s reasons for canceling, “We’re going to carry on.” Khan said the capital’s authorities were prepared for shows there following lessons learned from a 2017 attack at an Ariana Grande concert in Manchester, England, that killed 22 people.

Outside view of the Ernst Happel stadium in Vienna on Thursday, Aug.8, 2024. (AP Photo/Heinz-Peter Bader)

A suicide bomber had set up a knapsack with explosives in Manchester Arena. The bomb detonated at the end of Grande’s concert as thousands of young fans were leaving.

Last month, an attacker in England killed three girls and wounded 10 people in a knife attack during a Taylor Swift-themed dance and yoga class. Swift at the time said she was ‘’completely in shock’’ over the violence.

In Austria, the main suspect confessed that he had started planning the attack in July, authorities said. The 19-year-old just a few weeks ago uploaded to the internet an oath of allegiance to the current leader of the Islamic State group.

He was “clearly radicalized in the direction of the Islamic State and thinks it is right to kill infidels,” said Omar Haijawi-Pirchner, head of the Directorate of State Security and Intelligence.

Haijawi-Pirchner added that the suspect “wanted to carry out an attack in the area outside the stadium, killing as many people as possible using the knives or even using the explosive devices he had made.”

Outside view of the Ernst Happel stadium in Vienna on Thursday, Aug.8, 2024. (AP Photo/Heinz-Peter Bader)

During a raid of the suspect’s home in Ternitz, south of Vienna, investigators found chemical substances and technical devices that indicated “concrete preparatory acts,” said Franz Ruf, director general for public security at the Ministry of the Interior.

Authorities said they also found Islamic State group and al-Qaida material at the home of the second suspect, who is 17. That suspect, who has so far refused to talk, was employed a few days ago by a company providing unspecified services at the venue for the concerts. The 19-year-old is an Austrian with North Macedonian roots. The 17-year-old is an Austrian with Turkish and Croatian roots.

The North Macedonian Interior Ministry released a statement Thursday saying that it had received a request from Austria to look into the 19-year-old.

Both teens were arrested Tuesday. Neither of their names was released in line with Austrian privacy rules.

The suspects had undergone clear social changes recently, authorities said. The 19-year-old had quit his job but said he “still had big plans,” while the other broke up with his girlfriend. Neither suspect appeared to have a ticket to any of the shows, Haijawi-Pirchner said.

Karner said that Austria’s intelligence service had worked closely together with foreign intelligence services to capture the two teens. He did not identify the agencies, but added that the help was needed because Austrian investigators, unlike some foreign services, can’t legally monitor text messages.

The CIA declined to say Thursday whether U.S. intelligence agencies played any role in the investigation. The U.S. State Department and the broader U.S. government have been in contact with Austrian officials about the alleged plot, State Department spokesperson Matthew Miller said.

No other suspects are being sought, though a 15-year-old who had been in contact with both suspects was also interrogated by police, Karner said.

“The situation is serious. But we can also say: A tragedy was prevented,” he said.

Concert organizer Barracuda Music said in an Instagram post late Wednesday that it had “no choice but to cancel the three scheduled shows for everyone’s safety.”

Barracuda said all tickets would be refunded. The same message was posted under the Vienna dates on Swift’s official website. Austrian rail operator OeBB in the meantime said that it would reimburse fans for unused train tickets for the concerts.

Swift has not spoken publicly about the plot or canceled shows. “Taylor Nation,” a verified Instagram page widely believed to be run by her team, reposted the announcement from Barracuda Music in a “story,” which is only visible for 24 hours. Her main account has not posted anything.

Swift’s biggest fear has always been that such large-scale violence could take place at her concerts, the superstar told Elle magazine in 2019 ahead of her Lover Tour, which was ultimately canceled because of the coronavirus pandemic. The attack at Grande’s concert, as well as a 2017 mass shooting at an outdoor country music festival on the Las Vegas Strip where 58 people were killed, worried Swift as she prepared to circle the globe.

“I was completely terrified to go on (the Lover Tour) this time because I didn’t know how we were going to keep 3 million fans safe over seven months,” she told the magazine. “There was a tremendous amount of planning, expense, and effort put into keeping my fans safe.”

An official inquiry reported in 2023 that Britain’s domestic intelligence agency, MI5, didn’t act swiftly enough on key information and missed a significant opportunity to prevent the Manchester bombing, the deadliest extremist attack in the United Kingdom in recent years.

Terrorism expert Magnus Ranstorp, based at the Swedish Defense University in Stockholm, told The Associated Press by phone that any mass public event constitutes a potential threat now.

“So we shouldn’t be surprised that these extremely popular iconic popstars that attract a massive audience will also attract terrorists that want to create fear and destruction and mayhem,” he said.

___

Dazio and Grieshaber reported from Berlin. Associated Press writers Jan M. Olsen in Copenhagen, Denmark; Vanessa Gera in Warsaw, Poland; Danica Kirka in London; and David Klepper and Ellen Knickmeyer in Washington contributed to this report."
"ISIS-inspired suspect planned suicide attack at Taylor Swift concert, Austrian authorities say.",https://nypost.com/2024/08/08/world-news/taylor-swift-isis-suspects-planned-to-drive-bomb-riddled-car-into-crowd/,"The teen suspects arrested for plotting an ISIS-style “bloodbath” terror attack at one of Taylor Swift’s Austrian concerts this week had planned to drive a bomb-filled car into the crowd to kill “as many people as possible” and had reportedly just been hired by the venue to work security.

Terrifying details of the foiled suicide-bombing attack emerged after authorities revealed that two men, ages 19 and 17, had been taken into custody in Vienna on Wednesday — resulting in Swift’s three sold-out Eras shows in the city being canceled.

11 One of the suspects arrested in the Islamist attack plot on a Taylor Swift concert. APA/AFP via Getty Images

11 Terrifying details of the foiled attack emerged. REUTERS

The two suspects, who investigators say had become radicalized online by ISIS, had allegedly wanted to carry out the attack outside the Ernst Happel Stadium — killing fans with self-made explosives and machetes, security officials said Thursday.

“The suspects actually had very specific and detailed plans … to leave a bloodbath in their wake,” Austrian Chancellor Karl Nehammer said.

11 The teen suspects arrested for plotting an ISIS-style terror attack at one of Taylor Swift’s Austrian concerts this week had planned to drive a bomb-laden car into the crowd. Getty Images for TAS Rights Management

The alleged ringleader, a 19-year-old Austrian with North Macedonian roots, had chemical substances and technical devices stashed inside his home when it was raided by authorities, according to officials.

11 Fans gathered in the streets after the cancellations were announced. AP

He had allegedly also made progress in building the bomb he planned to strap to the car, they added.

Meanwhile, the second suspect — a 17-year-old Austrian citizen with Turkish and Croatian roots — was nabbed by special police forces near the stadium where the concerts were supposed to take place this week.

The second suspect had only just been employed a few days ago by a company providing services at the venue during the concerts, officials said.

Sources told German news outlet Kurier that he’d been hired to work there as security.

11 Fans gathered in the streets after the cancellations were announced. Getty Images

The pair had displayed noticeable changes in their behavior in the leadup to their arrests, according to Franz Ruf, public security director at Austria’s Interior Ministry.

Here's everything we know about the attempted terrorist attack at a Taylor Swift concert A 17-year-old and a 19-year-old were arrested for plotting an ISIS-style terror attack at one of Taylor Swift’s Austrian concerts this week.

The would-be terrorists planned to drive a bomb-filled car into the Eras Tour crowd to kill as many people as possible.

The main suspect — who authorities say fully confessed to the attack plans after his arrest — had recently sworn allegiance to Islamic State’s leader online, security officials said. He had reportedly just been hired by the venue to work security.

Swift’s three sold-out Eras shows in Vienna have been canceled.

Taylor Swift previously said her “biggest fear” in life was a violent attack at one of her concerts in a resurfaced article penned by the singer in 2019.

The older teen had quit his job on July 25 and told people he had “something big” planned, while the 17-year-old recently broke up with his girlfriend, Ruf said.

11 Fans gathered in the streets after the cancellations were announced. REUTERS

The pair had also made contact with others who were apparently aware of the terror plot plans.

A 15-year-old boy was also taken in for questioning Wednesday after the sinister plans were uncovered, though it was unclear if he had been arrested.

11 The now-canceled concerts had been slated to take place at Ernst Happel Stadium in Vienna Thursday through Saturday. APA/AFP via Getty Images

Meanwhile, both older suspects had been under surveillance by Austrian authorities and were known risks before their arrests, officials said.

Investigators said they found extensive material related to ISIS and al Qaeda during a raid at the second suspect’s home.

The main suspect — who authorities say fully confessed to the attack plans after his arrest — had recently sworn allegiance to Islamic State’s leader online, security officials said.

11 Fans gathered in the streets after the cancellations were announced. Getty Images

11 Franz Ruf, Director General for Public Security in Austria, addresses a press conference on August 8, 2024 in Vienna, Austri. APA/AFP via Getty Images

The older suspect was “clearly radicalized in the direction of the Islamic State and thinks it is right to kill infidels,” said Omar Haijawi-Pirchner, head of the Directorate of State Security and Intelligence.

Haijawi-Pirchner added that the suspect “wanted to carry out an attack in the area outside the stadium, killing as many people as possible using the knives or even using the explosive devices he had made.”

The names of those allegedly involved haven’t been released due to Austria’s privacy laws, and the 17-year-old suspect has reportedly refused to talk since his arrest.

Swift had been slated to play the three sold-out shows, which were expected to draw 195,000 people, Thursday through Saturday.

Nehammer defended the decision to nix the shows, saying they occurred too close to the arrests.

“I understand very well that those who wanted to experience the concert live are very sad,” the chancellor told a news conference Thursday. “Moms and dads are looking after their daughters and sons, who were full of enthusiasm and anticipation for this concert. But it’s also important that in such serious moments as now, it’s inevitable that safety comes first.”

It wasn’t immediately clear for which concert the thwarted attack was meant to target.

11 A statement from Barracuda Music cancelling the upcoming Taylor Swift concerts in Vienna was posted to Instagram Wednesday, Aug. 7, 2024. Barracuda Music

“The situation was serious, the situation is serious. But we can also say: A tragedy was prevented,” Austria’s Interior Minister Gerhard Karner said Thursday.

Event organizer Barracuda Music revealed in an Instagram post late Wednesday that “we have no choice but to cancel the three scheduled shows for everyone’s safety.”

It cited government officials’ confirmation of the planned attack at the stadium.

News of the terror threat — and subsequent cancellations — devastated “Swifties” across the globe.

Keep up with today's most important news Stay up on the very latest with Evening Update. Thanks for signing up! Enter your email address Please provide a valid email address. By clicking above you agree to the Terms of Use and Privacy Policy. Never miss a story. Check out more newsletters

11 Fans gathered in the streets after the cancellations were announced. Getty Images

Austria’s Vice Chancellor Werner Kogler said in a post in X: “For many, a dream has been shattered today. On three evenings in Vienna, tens of thousands of #Swifties should have celebrated life together.

“I am very sorry that you were denied this. Swifties stick together, hate and terror can’t destroy that,” Kogler wrote.

But some Swifties who had traveled to Vienna for the show were undeterred – with many turning out in the streets of the Austrian capital city to console each other over the near miss.

Filling the city streets by the hundreds, fans joined arms to belt out their favorite Swift songs together, swapped friendship bracelets, and shared group hugs.

Swift’s next shows, scheduled for August 15 through 20 in London, are expected to go ahead as planned.

“We’re going to carry on,” said London Mayor Sadiq Khan, adding that England had learned the hard way to deal with concert threats after a bomb detonated at a 2017 Ariana Grande concert killed 22 people.

Swift hasn’t yet commented publicly about the cancellations or terror threat.

With Post wires"
"ISIS-inspired suspect planned suicide attack at Taylor Swift concert, Austrian authorities say.",https://www.nytimes.com/2024/08/08/world/europe/taylor-swift-concert-terror-plot-vienna.html,"The youths accused of planning to attack a Taylor Swift concert in Vienna had hoped to kill as many people as possible, the Austrian authorities said on Thursday, outlining a plot designed to copy some of the worst terrorist assaults of the last decade.

“The suspects actually had very specific and detailed plans to cause a tragedy on the scale of Paris, Manchester or Moscow,” Karl Nehammer, the chancellor of Austria, said Thursday afternoon at a news conference, referring to attacks that killed hundreds of concertgoers in all. Mr. Nehammer said the two, arrested less than 24 hours earlier, wanted to leave a “trail of blood.”

Ms. Swift had scheduled three concerts in Vienna, the first on Thursday, and she had been expected to draw more than 200,000 fans from across the world. Barracuda Music, the promoter for the Vienna run, canceled the shows on Wednesday night in what it characterized as a decision coordinated with Ms. Swift’s management.

The Austrian authorities did not publicly identify either of the people arrested. They described the main suspect as a 19-year-old man who was radicalized online and swore an oath of allegiance to the Islamic State."
