Headlines,Links,ArticleBodyText
Colin Farrell opens up about his son with Angelman syndrome: ‘We still struggle.’’,https://nypost.com/2024/08/07/entertainment/colin-farrell-chokes-up-over-son-with-angelman-syndrome-as-he-launches-foundation/,"IRL, Colin Farrell is a superhero.

The Irish actor held back tears while giving insight into his life with his 20-year-old son, James, and opening up about the Colin Farrell Foundation, which aims to provide support for adult children with intellectual disabilities. Farrell created the foundation in honor of James, whom he shares with his ex, Kim Bordenave.

James was diagnosed with Angelman syndrome, a rare neurogenetic disorder that causes delayed development and problems with movement, balance and speech, per the Mayo Clinic.

4 Colin Farrell gets candid on his 20-year-old son James’ neurogenetic disorder in a rare interview with People. Warner Bros.

“I want the world to be kind to James,” Farrell told People in the interview published on Wednesday. “I want the world to treat him with kindness and respect.”

Taking a moment to gush over his son, the 48-year-old shared that James “has worked so hard all his life, so hard.”

“Repetition, repetition, balance, his jerky gait,” Farrell reflected. “When he started feeding himself for the first time, his face looks like a Jackson Pollock by the end of it. But he gets it in, he feeds himself beautifully. I’m proud of him every day, because I just think he’s magic.”

James turns 21 in September, which was a driving force behind the “Miss Julie” star’s decision to take matters into his own hands.

“Once your child turns 21, they’re kind of on their own,” Farrell explained. “All the safeguards that are put in place, special ed classes, that all goes away, so you’re left with a young adult who should be an integrated part of our modern society and more often than not is left behind.”

4 Colin Farrell shares son James with ex Kim Bordenave. Instagram/ Kim Bordenave

Meanwhile, the “Banshees of Inisherin” actor is looking to change that aspect and help young adults with intellectual disabilities receive the care they need through advocacy, education and innovative programs.

“This is the first time I’ve spoken about it, and obviously the only reason I’m speaking is I can’t ask James if he wants to do this,” Farrell confessed.

Giving insight into his communications with his son, the Golden Globe winner continued, “I mean, I can. I speak to James as if he’s 20 and has perfect fluency with the English language and age-appropriate cognitive ability.”

However, when it comes to getting James’ blessing on the project, Farrell, who is also dad to 14-year-old son Henry with ex Alicja Bachleda-Curús, is turning to his gut for the answer.

4 James turning 21 in September was the driving force behind Colin Farrell’s nonprofit. alicjabc/Instagram

He added, “But I can’t discern a particular answer from him as to whether he’s comfortable with all this or not, so I have to make a call based on knowing James’s spirit and what kind of young man he is and the goodness that he has in his heart.”

In order to promote his nonprofit, Farrell and the young adult participated in a photo shoot for the outlet, which led the actor to ponder: “If James knew getting his photograph in the back garden with me, which is not my favorite thing to do, if us doing this could help families and other young adults who live with special needs, he would say, ‘Dad, what are you talking about? Why are you even asking me? It’s a no-brainer.’”

“So that’s why we’re doing it,” he noted. “This is all because of James — it’s all in his honor.”

4 “I want the world to be kind to James,” Colin Farrell told People. “I want the world to treat him with kindness and respect.” kimbordenave/Instagram

But the star’s idea to start a foundation didn’t come out of left field.

Farrell admitted that for years, he has “wanted to do something in the realm of providing greater opportunities for families who have a child with special needs, to receive the support that they deserve, basically the assistance in all areas of life.”

As the Academy Award nominee put it, his eldest child and those similar to him have “earned the right to have a greater degree of individuality and autonomy on life, and a greater degree of community.”

In 2021, Farrell and Bordenave filed for James’ conservatorship to legally manage his needs once he turned 18.

The documents obtained by Page Six noted that James is “nonverbal, has issues with his fine motor skills and cannot provide for his own health and well-being.”

The paperwork also stated that while their child “lacks the capacity to express his preference over who he would want to serve as his conservator(s),” it is said that “he would choose [his parents] as co-conservators.”

In 2017, Farrell shared a rare insight into being a parent to James.

“The struggles of a child with special needs can be so brutal that they can tear at the very fabric of your heart,” he told Today at the time, “but the love shared and the pure strength and heroism observed is the needle and thread that mends all tears.”"
Colin Farrell opens up about his son with Angelman syndrome: ‘We still struggle.’’,https://www.livenowfox.com/news/angelman-syndrome-colin-farrell-son-foundation,"article

Colin Farrell is opening up about life with his 20-year-old son who has Angelman syndrome.

The Irish actor is sharing details of James’ life as they prepare for his 21st birthday, a milestone when many government safeguards for people with special needs are cut off.

Farrell is launching a new foundation in James’ honor with the goal of helping families across the country who are struggling with similar care issues for their adult children who have special needs.

Here is what to know about Angelman syndrome and Farrell’s new foundation:

What is Angelman syndrome?

Angelman syndrome (AS) is a rare neuro-genetic disorder that causes developmental delays.

It is caused by a missing or defective UBE3A gene in the 15th chromosome derived from the mother, according to the Angelman syndrome foundation .

The foundation says the disorder occurs in one in 15,000 births, or about 500,000 people worldwide.

Angelman syndrome causes delayed development that becomes noticeable around 6 - 12 months. People with AS also can have problems with speech and balance, mental disability, and, sometimes, seizures.

Angelman syndrome vs. autism

Angelman syndrome shares symptoms and characteristics with other disorders including autism, according to the Angelman syndrome foundation.

Similar traits include developmental delays, verbal issues and repetitive movements.

Hallmarks unique to AS include frequent smiles and outbreaks of laughter.

AS is also a confirmed genetic disorder, while there are many causes of autism .

Colin Farrell son

Actor Colin Farrell shared this month with People Magazine details of his life with 20-year-old son, James, who has Angelman syndrome.

Farrell remembers James as a baby barely making any sounds, and thinking he was just a ""chill, chill"" baby. But when James wasn’t hitting certain benchmarks, they suspected something was wrong.

James was initially diagnosed with cerebral palsy, which Farrell said is a common AS misdiagnosis. A year later, around 3 years old, James got the correct diagnosis.

Farrell said James is an incredibly hard worker and is very determined. James walked just shy of his fourth birthday and is able to complete certain tasks like taking off a T-shirt.

""He gifts me with the ability to look at the human being and the human body and life as a marvel because I see how much he struggles with things that I would’ve never given a second thought to; I would just, like many of us, take for granted,"" Farrell shared with People.

Farrell also credited James with being a big part in his sobriety.

Farrell has a second son, 14-year-old Henry, whom he shares with ""Ondine"" costar Alicja Bachleda-Curús.

James’ mother is Farrell’s ex-girlfriend Kim Bordenave.

Colin Farrell Foundation

In 2024, Farrell launched the Colin Farrell Foundation in honor of James.

The nonprofit provides support for families of adult children who have intellectual disabilities through education, advocacy and innovative programs.

""There are support systems in place across the country and it varies state to state, but once your child turns 21 they’re kind of on their own. All the safeguards that are put in place, all the inclusive programs, special ed classes, that all kind of goes away when your child is 21,"" Farrell told People. ""And so you’re left with a young adult who should be an integrated part of our modern society here and very much, more often than not, is left behind.""

Farrell said working with the foundation will help set in place what the next chapter of James’ life will look like, which is something other families struggle to figure out as well.

The foundation will focus on the lack of affordable and accessible community-based housing and day programs for people living with intellectual disability who require more than minimal daily living support.

Its goal is to create both small group homes, and large-scale communities, with access to meaningful and enriching day programs, across the country.

This story was reported from Detroit."
Colin Farrell opens up about his son with Angelman syndrome: ‘We still struggle.’’,https://www.thesun.co.uk/tvandshowbiz/29753543/colin-farrell-son-james-angelman-syndrome-foundation/,"COLIN Farrell has shared a very rare glimpse inside his life with son James who was born with Angelman syndrome.

The Oscar-nominated star, 48, has started a foundation to support adults with cognitive disabilities in honour of James.

6 Colin Farrell has shared a rare glimpse inside his life with son James Credit: Getty

6 The 20-year-old was born with Angelman syndrome Credit: Instagram

6 Colin said he 'wants the world to be kind' to his son as he approaches his 21st birthday Credit: Instagram

James was born with Angelman syndrome, a rare condition characterised by developmental delay, problems with speech and balance and, in some cases, seizures.

Colin's son will be turning 21 in September and anticipating the difficulty for adults with intellectual disabilities to gain independence the actor established The Colin Farrell Foundation.

Colin, who shares James with his ex, Canadian model Kim Bordenave, said in a new interview with People Magazine that he wants the ""world to be kind"".

The Irish star shared that James ""has worked so hard all his life, so hard"" at learning repetition and balance, and improving his jerky gait.

The In Bruges actor said: ""When he started feeding himself for the first time, his face looks like a Jackson Pollock by the end of it. But he gets it in, he feeds himself beautifully. I’m proud of him every day, because I just think he’s magic.

""This is the first time I’ve spoken about it and, obviously, the only reason I’m speaking is I can’t ask James if wants to do this.

""I mean, I can. I speak to James as if he’s 20 and has perfect fluency with the English language and age-appropriate cognitive ability.""

He explained that once children with James' cognitive abilities get to 21 much of the support put in place gets stripped away.

Which is what in-part inspired Colin to set up the foundation with the intention of helping others of a similar age.

And while Colin looks forward to his son's milestone birthday he can't help but be aware of the challenges it will bring to James.

The Banshees of Inisherin win big at Golden Globes as Colin Farrell pokes fun at cast

He said: "" He has earned autonomy, and he has earned having a greater sense of community and a greater sense of freedom.

""I've had 20 years to think about the struggles of a child with special needs... it's very much been localised for me, of course, personalised. It's very much been about James, about my son.

""James has benefited a lot from the doctors I can get on the phone easier than most people, from the money I have to pay for certain therapeutic interventions.""

He went on: ""Once your child turns 21, they’re kind of on their own.

What is Angelman syndrome? Angelman syndrome is a rare genetic condition which affects the nervous system and causes severe physical and learning disabilities. Children with it have their development delayed when they are between six and 12 months old. Those with the condition have a near-normal life expectancy, but they will need lifelong support. It affects around one in 20,000 births.

This leads to them being unable to sit up unsupported, and they sometimes make babbling noises.

Later, they may not be able to speak at all, or will only be able to say a few words.

Most children with Angelman syndrome are able to communicate through gestures, signs or other methods.

The condition can also make walking difficult because of issues with balance and coordination.

Other physical signs include trembling arms or jerky movements, crossed eyes, a tendency to stick the tongue out, and the legs may also be stiff.

Angelman syndrome can cause children to laugh frequently with little reason, become easily excitable and restless, and can also give them a fascination with water.

They can also have a short attention span, struggle to sleep, and need less sleep than those without the syndrome.

Those with the condition have a near-normal life expectancy, but they will need lifelong support.

The most common cause of Angelman syndrome is when the gene known as UBE3A is either missing or not working properly.

A child usually gets two copies, one from each parent, but only the one from the mother is active. In most cases of Angelman syndrome, the child does not get a copy of the UBE3A gene from its mother, or the gene is not working. This means there is no active copy of the gene in the child's brain.

Source: NHS

""All the safeguards that are put in place, special ed classes, that all goes away, so you’re left with a young adult who should be an integrated part of our modern society and more often than not is left behind.""

The Spaceman actor was seen playing with a ball in the garden with James during the photoshoot for People Magazine.

Colin said if James knew the purpose behind the shoot was to help young adults who live with special needs, he would say: ""Dad, what are you talking about? Why are you even asking me? It’s a no-brainer.""

The film star also has another son called Henry, 14, with actress Alicja Bachleda-Curús.

The focus of the foundation will begin in California - where the family live and work and Colin has ambitions to spread their endeavour across the US and ultimately to Ireland.

Advocate for children

Colin will lead the foundation, but be supported by a highly experienced board of directors and CEO.

The foundations CEO is Paula Evans who established FAST - The Foundation for Angelman Syndrome Therapeutics in the States.

Even before having James, Colin was an advocate for children with additional needs as he proudly stood front and centre in Croke Park for the 2003 Special Olympics.

And since then Colin has served as an Ambassador for the Special Olympics, each Olympiad raising money for the event and sometimes - even making an appearance.

FAMILY LIFE

Colin paid tribute to the two as the “loves of his life” in his 2023 Golden Globes acceptance speech.

He said of James, now 19, and 13-year-old Henry: “My kids at home are watching this, James and Henry, the loves of my life. I love you so much.”

Speaking of James and his achievements, he told People in 2013: “Things like walking and talking and eating and feeding himself, all those things that so many of us naturally take for granted because they come so easily, to James, they come somewhat harder.

“Everything he's achieved in his life has come through the presence and the kind of will that is hard work. He's a lot to be inspired by.”

He joked how younger son Henry was left mortified by one of his fashion choices.

He told Ellen DeGeneres: “I didn't know [short shorts are] in now. My youngest son would disagree vehemently with you. Because he's mortified.

“He says, 'Please Dad, do not wear the short shorts.' And I tell him, 'They feel good.' It's not a fashion thing.”

And in 2020, he told of his close bond with the two.

He told Express: “Although I don't know what I'm doing as a parent most of the time, I'm just flying by the seat of my pants. I think that as simple as it sounds, if you are just present and attentive as a parent, and also as cheesy as this sounds open to learning from your child, then that's the best you can do.”

And he said he has “very open and communicative relationships” with them, adding: “But just as I've introduced them to the best aspects of myself, I've also introduced them, just by virtue of regularly interacting with them, to the most traumatised and damaged aspects of myself. They are both of them there for me, like two samurai masters, there to teach me a lot of stuff.”

6 Colin started a foundation to support adults with cognitive disabilities in honour of his son James Credit: Getty

6 Colin and Kim Bordenave are parents to James Credit: Reuters"
Colin Farrell opens up about his son with Angelman syndrome: ‘We still struggle.’’,https://evrimagaci.org/tpg/colin-farrell-champions-support-for-adults-with-angelman-syndrome-8243,"Colin Farrell Champions Support For Adults With Angelman Syndrome The actor launches foundation to aid families grappling with intellectual disabilities and raises awareness of Angelman Syndrome

Colin Farrell, the acclaimed Irish actor, recently opened up to share the unique joys and struggles he experiences as the father of James, his 20-year-old son diagnosed with Angelman Syndrome—a rare neurogenetic disorder. This heartfelt disclosure came amid the announcement of the Colin Farrell Foundation, which aims to provide advocacy and support for adults with intellectual disabilities, highlighting Farrel's intention to raise awareness about the challenges faced by families with similar circumstances.

Angelman Syndrome affects roughly one in 15,000 people globally and is characterized by developmental delays, issues with speech and coordination, and, often, seizures. Individuals with this disorder typically have normal life spans, but many will not be able to live independently nor reach the same milestones as their peers.

For Farrell, the diagnosis was not immediately apparent. He reflected on the early days when James seemed like just the most relaxed baby, failing to hit typical developmental milestones but continuing to bring joy to his family. It wasn't until James reached age two, after observing developmental delays, testing revealed the cause: Angelman Syndrome.

One of the most poignant moments Farrell recounted was when James took his first steps just short of his fourth birthday. He described it as ""profound"" and “magical,” recalling how his heart swelled with pride and joy watching his son make progress against all odds. “To be told he may never walk and then seeing those first steps was overwhelming,” Farrell stated, tears coming to his eyes as he shared this touching memory.

Following this, it became apparent to Farrell how critical it is to advocate for children like James once they enter adulthood. He revealed the harsh reality many families face as their children age out of special education and support systems. “Once your child turns 21, they’re kind of on their own. All the safeguards... go away. You’re left with a young adult who should be integrated but often is left behind,” he lamented. This realization inspired Farrell to create the Colin Farrell Foundation, with initiatives aimed at filling the support gaps for families not only during childhood but continuing through adulthood.

While many children with Angelman Syndrome exhibit cheerful dispositions, they can also struggle significantly with coordination and functional speech. Treatment focuses heavily on managing symptoms through therapy, aiding families to cope effectively with the challenges imposed by such conditions. Despite these struggles, James’ personality has shone through, and Farrell often describes him as ""magic.” At home, they find joy exploring various activities together, such as playing catch, which brings smiles to both father and son.

Farrell’s desire to connect with others facing similar challenges spurred him to share his family’s story publicly. He explained with sincerity, “I want the world to be kind to James. I want the world to treat him with kindness and respect.” Through his foundation, he aims to raise awareness and promote advocacy for individuals like James, ensuring they retain autonomy and community integration.

Angelman Syndrome is caused by a genetic mutation, often involving deletions or changes to the 15th chromosome. Symptoms usually become noticeable before the age of two, and those affected may experience challenges such as severe developmental delays, mobility issues, and epilepsy. Despite this array of difficulties, there's considerable potential for these individuals to flourish within nurturing environments.

The Colin Farrell Foundation endeavors to support adults with Angelman and similar syndromes by creating systems of resources and advocacy. By emphasizing communal support and awareness, Farrell is striving to make the future brighter for families who might currently feel isolated or overwhelmed as their loved ones reach adulthood without ready support systems.

Farrell’s commitment reflects not only his love for James but also his larger vision for social change. He envisions a society where individuals with disabilities are seen as full members of communities rather than marginalized individuals. His efforts also encourage policymakers and society to create more inclusive environments for those living with disabilities.

His heartfelt approach and vulnerability have captured many hearts, showcasing not only the strength of familial love but also the urgent need for better support frameworks for those with disabilities. Through initiatives to increase awareness about Angelman Syndrome and build community support systems, Colin Farrell is turning his family's challenges and experiences with disability advocacy and empowerment. He’s certainly paving the way for more families to find their voice and the strength needed to face similar circumstances."
