Headlines,Links,ArticleBodyText
Steve Martin has turned down playing Tim Walz on Saturday Night Live.,https://www.nj.com/entertainment/2024/08/everyone-wanted-steve-martin-to-play-tim-walz-on-snl-he-said-no-heres-why.html,"When Kamala Harris announced that Tim Walz would be her running mate in the presidential election, Steve Martin soared to the top of a short list.

The list?

Who would play the Minnesota governor on “Saturday Night Live,” of course.

But Martin, frequent “SNL” guest host and veteran actor-comedian, had to turn producer Lorne Michaels down.

“I wanted to say no and, by the way, he wanted me to say no,” Martin told the Los Angeles Times. “I said, ‘Lorne, I’m not an impressionist. You need someone who can really nail the guy.’ I was picked because I have gray hair and glasses.”

Martin, who has an Emmy, five Grammys and an honorary Oscar, previously acknowledged the public call for him to play Walz by posting a good-natured line on Threads:

“I just learned that Tim Walz wants to go on the road with Marty Short.”

But Martin, 78, who is again nominated for an Emmy alongside co-star Martin Short for Hulu’s “Only Murders in the Building,” pointed out that the “SNL” gig would require appearances over multiple episodes.

More: Born to run? Tim Walz is a Springsteen guy. Also big on turkey, Diet Mountain Dew.

“It’s ongoing,” he told the LA Times. “It’s not like you do it once and get applause and never do it again. Again, they need a real impressionist to do that. They’re gonna find somebody really, really good. I’d be struggling.”

Other names in the public conversation about who will play Walz include actor and comedian Jim Gaffigan; former “SNL” writer and star Al Franken, who is also a former Minnesota senator (who shared a hearty endorsement of Walz on Instagram); and sketch comedy veteran Rick Moranis (”SCTV,” “Ghostbusters”).

Maya Rudolph, an “SNL” cast alum who already plays Kamala Harris on the show, will be back to play the Democratic presidential nominee.

Rudolph, who debuted her “SNL” impression of then-Sen. Harris 2019, won an Emmy for her performance as the vice president in 2020 and another Emmy in 2021 for guest hosting the show, among her five career Emmys.

Deadline reports that production on Rudolph’s Apple TV+ series “Loot” will be delayed as she returns to play the vice president again when “SNL” enters its 50th season Sept. 28.

Rudolph is set to play Harris through the presidential election.

Harris herself has praised the actor for her impression.

“I grew up watching ‘Saturday Night Live’ so the thought that anyone would be in any way depicting me on ‘Saturday Night Live,’ I was a bit overwhelmed,” she told Seth Meyers in 2019. “But I will tell you that I fully intend to make sure she has a good eight years of work on ‘SNL.’”

Cue Harris’ famous laugh.

Rudolph is up for four awards at the 2024 Emmys in September. She’s nominated for guest hosting “SNL” and co-writing the music and lyrics her oh-so-mother Mother’s Day monologue song as well as for her performances as Molly Novak in “Loot” and Connie the Hormone Monstress in the Netflix animated series “Big Mouth.”

Thank you for reading. Please consider supporting NJ.com with a subscription.

Amy Kuperinsky may be reached at akuperinsky@njadvancemedia.com and followed at @AmyKup."
Steve Martin has turned down playing Tim Walz on Saturday Night Live.,https://www.film-news.co.uk/news/UK/111885/Steve-Martin-turns-down-Tim-Walz-role-on-SNL,"Steve Martin has turned down the chance to impersonate potential Vice President Tim Walz on Saturday Night Live.

The actor has been touted as the front runner to play Kamala Harris' running mate on SNL.

However, he's confirmed he isn't interested in taking on the much-publicised part, revealing he'd already spoken to SNL producer, Lorne Michaels about appearing on the cult show.

""I wanted to say no and, by the way, he wanted me to say no,"" Steve, 68, told the Los Angeles Times.

""I said, 'Lorne, I'm not an impressionist. You need someone who can really nail the guy.' I was picked because I have grey hair and glasses.""

He added that committing to parodying the governor of Minnesota didn't align with his current work schedule.

""It's ongoing. It's not like you do it once and get applause and never do it again. Again, they need a real impressionist to do that. They're going to find somebody really, really good. I'd be struggling.""

Maya Rudolph played Kamala Harris on SNL in 2019 when she ran for the democratic nomination for president, and has confirmed she'll reprise the role in the 50th season of the show.

""I think it starts with trying to get someone's voice if you can,"" the actress said in 2020. ""There's nothing crazily overt about Sen. Harris, but I have to tell you, when I got to (SNL) and they put the wig on me, it was done."""
Steve Martin has turned down playing Tim Walz on Saturday Night Live.,https://www.msn.com/en-us/tv/news/steve-martin-reportedly-turned-down-offer-from-lorne-michaels-to-play-tim-walz-on-snl/ar-AA1opmTp?ocid,
Steve Martin has turned down playing Tim Walz on Saturday Night Live.,https://uk.news.yahoo.com/al-franken-tim-walz-colin-220302845.html,"It’s an election year and with all of the media frenzy and speculation, a bevy of new faces have stoically entered the national political fray. This sort of national political exposure comes for these career civil servants at a major inflection point for the country. So, naturally, this means that their parody equivalent will mock everything about them when they appear in Studio 8H at 30 Rockefeller for Saturday Night Live in a matter of weeks.

SNL returns for its 50th season with new episodes on Sept. 28 while the presidential election is set for Nov. 5. This gives the sketch comedy series six episodes before the race is decided to perfect caricatures of our nation’s next leaders. News broke last week that SNL alum and comedy superwoman Maya Rudolph will return to portray Harris (and let’s face it, would we ever want anyone else?). With his involuntary manslaughter charge dismissed, Alec Baldwin is available to return to his Emmy-winning turn as Donald Trump — or perhaps current castmember James Austin Johnson, who has portrayed the former president over the last few years, will reprise the role.

More from The Hollywood Reporter

This leaves the comic actors who will portray J.D. Vance and Tim Walz, the two veep candidates, yet to be cast. Of course, online speculation began the moment that their respective attachments to the GOP and Democratic tickets were announced, and within 48 hours, one of the obvious candidates publicly stated his lack of interest (more on that below). So, who should it be? The trick with an impression is to extract the nuance of their speech, any idiosyncrasies or mannerisms, and — you betcha! — any catchphrases they deliver. Here are The Hollywood Reporter’s picks to round out the top contenders of the 2024 presidential campaigns.

Tim Walz

Steve Martin

The hair. The glasses. It was blindingly obvious to anyone who knows Steve Martin, the treasured comic actor prone to frequent SNL hosting bookings (he’s a member of the 16-Timers Club) and cameo appearances. Many don’t even realize he was never a castmember. An SNL legend — his classic “King Tut” performance turned 46 this year — what could be more perfect than Martin returning to spoof the potential next VP? Not doing it. Martin told the Los Angeles Times on Wednesday that he turned down Lorne Michaels’ request to play the vice presidential candidate.

“I wanted to say no and, by the way, he wanted me to say no,” Martin told the outlet. “I said, ‘Lorne, I’m not an impressionist. You need someone who can really nail the guy.’ I was picked because I have gray hair and glasses.”

Bradley Whitford

If SNL’s casting department is looking for someone with that white man, Midwestern, on-the-cusp-of-Gen-X Walz look, and Martin is unwilling to come on board, the next best thing is West Wing alum and Get Out villain Bradley Whitford. While he’d have to ditch the beard if he’s sporting a fuzzy face in late September, Whitford ticks plenty of boxes: he’s just 4 years older than Walz; their hairline and color nearly match; and Whitford is a staunch Democrat with a dry wit. He recently had one of the better lines in the White Dudes for Harris Zoom call when he mentioned the “rainbow if beige” he saw on his screen filled with white men.

Al Franken

Once again, the glasses could make it work. SNL-player-turned-U.S. Senator Al Franken, who resigned in disgrace (and some say, without due process) during a #MeToo scandal in 2018, could portray Walz. If he were to do so, it would be the strangest melding of politics and comedy seen since…well, since Franken won a U.S. Senate seat in 2008. The 73-year-old has also said that he regrets resigning from his Senate role after one of his accuser’s accounts of his acts of sexual misconduct were found to be exaggerated and that he may run to gain his seat back. Could a role on SNL be his springboard for a return to politics? It would be a bold move but may be a risk that Michaels will want to take.

The rest: Chris Farley was floated by many online speculators for the Walz role, but he is still dead, so, no. Danny Devito, the comedy legend, is always welcome. John Goodman got some mentions, too; he has a great history of SNL appearances (remember his Linda Tripp?), and like DeVito, should always be offered a seat at the table.

J.D. Vance

Colin Jost

The torch of a talented writer who sat in the head writer chair at Studio 8H going on to portray a GOP VP hopeful could be passed from Tina Fey to Colin Jost if he were to take on the role of J.D. Vance this season. Trump’s ripe-for-satire pick of a running mate has been off to a wobbly start to the campaign, and the public knows enough about his backstory and personal life that Jost would have plenty to pick (on) from. The writers room top dog (along with co-head writer Michael Che) might have to give up his golfing habit for a few weeks to prep, but it would be nice to see him step out front of the “Weekend Update” desk, slap on some eyeliner and give Vance a ribbing that could unite the parties in laughter.

Jason Sudeikis

The beloved SNL alum and Ted Lasso himself is wildly popular for the latter, but if he were thinking ahead, he’d be gunning for this gig. After all, the Ted Lasso love won’t go on forever. His nine-season run was full of funny-as-hell original characters and impressions of three major political figures over this tenure: President George W. Bush, current President Joe Biden, and onetime presidential hopeful Mitt Romney. Why not come back for a fourth one, Jason? I mean, as savvy SNL fanatics, or those who just watch it way too closely, will recall, he already portrayed a guy named Vance on the beloved “What Up With That?” series of sketches.

Shane Gillis

The story on Shane Gillis and SNL could have a redemption chapter if he were to be offered and then absolutely nail the Vance impression that the people all want and need. Gillis was fired from the show ahead of the 2019 season when ethnic slurs he’d used in the past were resurfaced. Since then, he launched the very, very popular Matt and Shane’s Secret Podcast and was invited to return as an SNL host in season 49. He was shaky at best, but there were some laughs in the episode. Michaels has also expressed regret over what happened with his casting on the show. Perhaps this is just too perfect? Maybe so, but maybe not for everyone still feeling stung by Gillis’ language and tone.

The rest: Current SNL cast member Mikey Day has got the look and would totally work as Vance. Ditto for former castmember Taran Killam — although it seems his departure was less than amiable, and he was certainly upset that Trump was allowed to host the show amid his first presidential campaign. Maybe the show should do some meta-casting and go with Gabriel Basso, the actor who portrayed Vance in Hillbilly Elegy, Ron Howard’s widely panned Netflix adaptation of his memoir?

Best of The Hollywood Reporter"
Steve Martin has turned down playing Tim Walz on Saturday Night Live.,https://www.newsmax.com/thewire/steve-martin-tim-walz-snl/2024/08/08/id/1175758/,"Steve Martin has declined an offer to portray Minnesota Gov. Tim Walz on ""Saturday Night Live.""

Fans made the call within hours of Vice President Kamala Harris, the Democratic Party's presidential nominee, announcing her running mate in the 2024 election. Maya Rudolph has already confirmed she'll reprise Harris on the upcoming 50th season, People reported.

Martin, 78, inadvertently caused a sensation when he wrote on Threads, ""I just learned that Tim Walz wants to go on the road with Marty Short.""

One person on X promptly posted a side-by-side photo of the actor and Walz, writing, ""So Steve Martin is definitely gonna play Walz on SNL right.""

Another person added, ""SNL get Steve Martin on the phone NOW.""

The buzz led to ""SNL"" creator Lorne Michaels inviting Martin onto the late night show, but he declined.

""I wanted to say no and, by the way, he wanted me to say no,"" Martin told the Los Angeles Times after disclosing how Michaels had called him. ""I said, 'Lorne, I’m not an impressionist. You need someone who can really nail the guy.' I was picked because I have gray hair and glasses.""

Martin also highlighted how much of a commitment it would be to take on the role.

""It’s ongoing. It’s not like you do it once and get applause and never do it again. Again, they need a real impressionist to do that. They’re gonna find somebody really, really good. I’d be struggling,"" he said.

Days earlier, Deadline confirmed that Rudolph would return to the late-night sketch comedy show. She originally took on the role in 2019, when Harris ran for the democratic nomination for president. She later spoke to Harris about the role, saying it was ""embarrassing"" as she detailed her approach to portraying the vice president.

""In terms of Senator Harris, I didn't have an impression because I wasn't walking around the house doing my 'Kamala.' But I think it starts with trying to get someone's voice if you can,"" she said, according to People. ""There's nothing crazily overt about Sen. Harris, but I have to tell you, when I got to [SNL] and they put the wig on me, it was done."""
Steve Martin has turned down playing Tim Walz on Saturday Night Live.,https://www.bloomberg.com/news/articles/2024-08-08/clash-of-the-yachts-steve-martin-says-no-to-snl-social-buzz,"Welcome to Social Buzz, a daily column looking at what’s trending on social media platforms. I’m Louise Moon on Bloomberg’s Breaking News team, which monitors everything from company statements to social-media posts from some of the most prominent people in the financial world. Here’s your daily look at what the internet is talking about.

Venus, the yacht of late Apple founder Steve Jobs designed with Philippe Starck was in a minor accident in Naples with Lady Moura, a luxury vessel owned by Mexican billionaire Ricardo Salinas Pliego. In a post on X, the Mexican billionaire urged clients of his Grupo Elektra retail chain to buy Apple products to help Jobs’ widow, Laurene Powell Jobs, pay for the “inconvenience.”"
Steve Martin has turned down playing Tim Walz on Saturday Night Live.,https://www.cleveland.com/tv/2024/08/famous-actorcomedian-passes-on-calls-to-portray-vice-presidential-candidate-on-snl.html,"LOS ANGELES, California — Steven Martin was never a full-time cast member on “Saturday Night Live,” but he’s an integral part of the show’s long history, having hosted 16 times and making numerous other guest appearances.

So when people noticed Martin has a passing resemblance to Tim Walz, the Democratic candidate for vice president, there were calls on social media for him to portray Walz for the upcoming 50th season of “SNL.” The show has turned to famous actors and comedians in recent years to portray political candidates, including Alec Baldwin as Donald Trump and Jim Carrey as Joe Biden.

But fans of Martin shouldn’t get their hopes up, according to the Los Angeles Times.

Martin, 79, politely but quickly declined an offer Wednesday from “SNL” producer Lorne Michaels to portray Walz on the show, The Times reports.

“I wanted to say no and, by the way, he wanted me to say no,” Martin said, according to The Times. “I said, ‘Lorne, I’m not an impressionist. You need someone who can really nail the guy.’ I was picked because I have gray hair and glasses.”

Former “SNL” cast member Maya Rudolph has agreed to return to portray Democratic presidential candidate Kamala Harris, reports say. Current cast member James Austin Johnson has been portraying Trump in recent seasons.

Martin’s history with “SNL” goes back to its early days in the 1970s, when he appeared with original cast members such as Dan Akroyd, Gilda Radner and John Belushi. His memorable moments include performing “King Tut” and the “Two Wild and Crazy Guys” skits with Akroyd.

He most recently co-hosted the show with Martin Short in December 2022."
Steve Martin has turned down playing Tim Walz on Saturday Night Live.,https://www.wglr.com/2024/08/07/steve-martin-declined-snl-offer-to-play-tim-walz-says-im-not-an-impressionist/,"After Kamala Harris announced Tim Walz as her running mate, speculation arose about Steve Martin portraying the Minnesota governor on Saturday Night Live due to their physical resemblance and similar demeanor. Martin even engaged with the idea, joking on Threads: “I just learned that Tim Walz wants to go on the road with Marty Short.” But when Lorne Michaels called him yesterday, he declined the offer. “I wanted to say no and, by the way, he wanted me to say no,” Martin told the Los Angeles Times. “I said, ‘Lorne, I’m not an impressionist. You need someone who can really nail the guy.’ I was picked because I have gray hair and glasses.” He also isn’t looking for than kind of commitment. “It’s ongoing,” Martin said. “It’s not like you do it once and get applause and never do it again. Again, they need a real impressionist to do that. They’re gonna find somebody really, really good. I’d be struggling.” (Variety)"
Steve Martin has turned down playing Tim Walz on Saturday Night Live.,https://b105country.com/ixp/164/p/snl-tim-walz-vp/,"'Saturday Night Live' is gearing up for a new season, and with it being an election year, they are looking to cast the roles of the candidates, and one SNL legend has said no to playing the role of Minnesota Governor and VP candidate Tim Walz.

Since joining the ticket as Kamala Harris' running mate, Walz has had his life turned upside down, with endless campaign stops, interviews, and the constant wondering of who will play him on SNL. The internet had already decided who should play him, but it's now being reported that they are passing on the role.

READ MORE: The Price of This Popular Minnesota State Fair Favorite Will Increase in 2024

Kamala Harris And Tim Walz Campaign In Michigan Getty Images loading...

After the announcement of Walz as the VP candidate, social media immediately blew up with suggestions that SNL legend Steve Martin join another SNL legend, Maya Rudolph, as the Harris/Walz ticket on the show, but while Rudolph is 100% on board for the Harris role, Martin is not.

The Los Angeles Times reports that 'Saturday Night Live' producer Lorne Michaels actually placed a call to Martin to discuss the role, but Martin told the LA Times that both him and Michaels ""wanted me to say no"".

""Meteor Shower"" Broadway Opening Night Getty Images loading...

Martin says that he told Michaels that he needed an impressionist to play the role, and that he is not that guy, telling him, ""I was picked because I have gray hair and glasses"".

Martin also pointed out in his comments to the LA Times that playing the role isn't just a one time appearance, it's a commitment, and he's a busy guy with his hit show 'Only Murders in the Building', and other projects including touring with his co-star and friend Martin Short.

""Pictures From Home"" Broadway Opening Night Getty Images loading...

The season premiere of SNL is scheduled for September 28th, and there is no doubt that both the Trump/Vance and Harris/Walz tickets will be represented in a big way during that show and subsequent shows until the election.

LOOKS: Things you'd likely see in an awesomely '80s garage From scandalous bikini calendars to your dad's AMC Gremlin, '80s garages were a treasure trove of adventure, good fun, and sometimes downright danger.

Gallery Credit: Stephen Lenz"
Steve Martin has turned down playing Tim Walz on Saturday Night Live.,https://tribune.com.pk/story/2486429/steve-martin-declines-saturday-night-live-role-as-democratic-vp-nominee-tim-walz,"Steve Martin, the legendary comedian, has declined an offer to play Minnesota Governor Tim Walz on ""Saturday Night Live"" (SNL). Martin was approached by SNL producer Lorne Michaels to play Walz, who is the running mate of Democratic presidential nominee Kamala Harris. However, Martin politely declined the offer, citing his lack of experience as an impressionist.

""I'm not an impressionist,"" Martin told The Times. ""You need someone who can really nail the guy."" Martin, who will turn 79 next week, was not willing to commit to playing Walz throughout the election cycle. ""It's ongoing,"" he said. ""It's not like you do it once and get applause and never do it again.""

Martin's decision leaves the door open for another comedian to take on the role. Maya Rudolph, who will reprise her portrayal of Harris, is set to return to SNL for its 50th season, which premieres on September 28. Rudolph has been playing Harris since 2019, when she first appeared on the show during the Democratic presidential primaries.

It's unclear who will ultimately play Walz on SNL, but Martin's decision ensures that the show will find a talented impressionist to take on the role."
